JHL Jalin Kerja Sama dengan Hotel dan Grandlucky untuk Pasok SayuranJHL Jalin Kerja Sama dengan Hotel dan Grandlucky untuk Pasok SayuranTim RedaksiBOGOR, KOMPAS.com - Yayasan JHL Merah Putih Kasih (YMPK) menggandengsejumlah restoran, hotel, dan jaringan supermarket besar untuk memasok sayuran dari kebunnya.Kebun sayur dan buah seluas enam hektar milik JHL di Pakancilan, Megamendung, Kabupaten Bogor, Jawa Barat, akan memasok kebutuhan sayur di 15 restoran, hotel, dan supermarket.Baca juga: Pertumbuhan Luas Kebun Durian di Vietnam Berdampak Negatif ”Indonesia adalah negeri dengan kekayaan alam berlimpah dan tanah yang subur. Sayang, lahan yang sangat luas ini belum digarap dengan baik. Bahkan, salah dalam mengelolanya,” kata Ketua Dewan Pembina YMPK, Jerry Hermawan Lo dalam acara penandatangan kerja sama di kebunnya, Sabtu (21/9/2024).Penandatangan kerja sama ini dihadiri oleh perwakilan tiap perusahaan retail dan hospitality tersebut, seperti GrandLucky, Angke Jaya Resto, Seven Kingdoms Resto, Babah Ramu Dine & Bar, Arooma Asian Bistro, Al Gusto Restoran, Mangan, Restoran, Royal 8 Chinese Dining, dan Roemah Koffie.Baca juga:Selanjutnya, ada juga JHL Solitaire Gading Serpong Hotel, Episode Gading Serpong Hotel, Herloom Serviced Residence BSD, JSI Resort, JHL Collection dan klub sepak bola Dewa United.”Kerja sama dengan para tenant ini sangat diperlukan supaya sayuran segar dari para petani bisa terserap. Dengan begitu, simbiosis mutualisme antara penyedia dan pembeli sayuran pasca panen dapat terjamin,” ujar Jerry.Kebun yang dikelola oleh masyarakat sekitar Desa Pakancilan, menghasilkan sayuran berupa kembang kol, pakcoy, terong, cabai, tomat, sawi, kangkung, serta buah berupa stroberi.Selama ini, hasil kebunnya dijual dengan harga suka-suka untuk masyarakat sekitar. Tidak ada patokan harga sayur dan buah yang diberikan oleh kebun Yayasan MPK.Baca juga: A post shared by Foodplace (@my.foodplace)Copyright 2008 - 2024 PT. Kompas Cyber Media (Kompas Gramedia Digital Group). All Rights Reserved.
5 Bumbu Dapur yang Bisa Obati Batuk, Ternyata Mudah Didapat5 Bumbu Dapur yang Bisa Obati Batuk, Ternyata Mudah DidapatPenulisKOMPAS.com - Batuk sering kali menjadi gangguan yang membuat aktivitas sehari-hari berantakan.Namun, tidak perlu langsung pergi ke apotek untuk membeli obat. Anda ternyata bisa memanfaatkan bumbu dapur yang ada di rumah untuk membuat obat herbal sendiri.Bumbu-bumbu dapur untuk mengatasi batuk ini bahkan bisa didapatkan dengan mudah saat berbelanja di pasar.Baca juga: Apa Obat Alami untuk Mengatasi Batuk Pilek?Berikut adalah daftar lima bumbu dapur yang dapat digunakan untuk meredakan batuk secara alami:Jahe sudah dikenal luas sebagai bumbu dapur yang berkhasiat dalam menghangatkan tubuh dan melegakan tenggorokan, sehingga sangat efektif meredakan batuk.Sebuah kiriman dibagikan oleh Foodplace (@my.foodplace)Selain itu, jahe juga dapat meningkatkan daya tahan tubuh. Cara membuat ramuan dari jahe sangat sederhana.Anda bisa merebus beberapa potong jahe dan meminum air rebusannya, terutama pada malam hari untuk hasil yang lebih efektif.Baca juga: Resep Air Lemon Madu Sederhana untuk Bantu Redakan Batuk Jika tidak, bakar 2-3 buah jahe selama sekitar satu menit, tumbuk kasar, lalu campurkan dengan air panas sebelum diminum.Kunyit, selain digunakan sebagai pewarna alami dalam makanan, juga memiliki khasiat dalam meredakan batuk.Cara penggunaannya adalah dengan menumbuk kunyit hingga halus atau menggunakan bubuk kunyit, lalu mencampurnya dengan susu hangat.Baca juga: Jarang Diketahui, 6 Penyakit yang Bisa Diredakan dengan Air Rebusan Jahe dan KunyitMinum campuran ini sebelum tidur untuk mendapatkan manfaat maksimal. Kunyit diyakini dapat membantu mencegah batuk dan menjaga kesehatan tenggorokan.Kencur sering menjadi rahasia para penyanyi dan pembawa acara untuk menjaga kesehatan pita suara mereka.Selain menjaga suara tetap prima, kencur juga efektif meredakan batuk berdahak. Cara konsumsinya cukup mudah.Baca juga: Kencur Bisa Mengatasi Penyakit Apa Saja? Ini 7 DaftarnyaAnda bisa mengunyah kencur yang sudah dicuci bersih, atau menumbuknya hingga halus, memeras sarinya, dan mencampurkannya dengan air hangat sebelum diminum. Ramuan ini dapat membantu mengatasi batuk secara alami.Bawang putih mungkin lebih dikenal sebagai bumbu masakan, namun ternyata juga memiliki manfaat sebagai obat herbal untuk batuk.Copyright 2008 - 2024 PT. Kompas Cyber Media (Kompas Gramedia Digital Group). All Rights Reserved.
Jakarta Dessert Week 2024 Digelar Akhir September, Bertema WildlifeJakarta Dessert Week 2024 Digelar Akhir September, Bertema WildlifeTim RedaksiJAKARTA, KOMPAS.com - Acara tahunan Jakarta Dessert Week akan kembali hadir selama tiga minggu pada 30 September-20 Oktober 2024.Ini adalah kali keenam festival hidangan penutup (dessert) hadir di Jakarta, setelah pertama kali diinisiasi oleh lima pelaku industri kuliner pada 2019."Format Jakarta Dessert Week 2024 adalah restaurant week. Ini konsep baru yang kami hadirkan di Indonesia, yang mungkin, belum pernah ada di Indonesia," ujar Primo Rizky, salah satu pendiri Jakarta Dessert Week dalam acara kick-off Jakarta Dessert Week 2024 di Flor Jakarta, Kamis (29/8/2024).Baca juga: Pebisnis Dessert Wajib Tahu, Ini 3 Cara Simpan Mentega agar Tak Tengik"Orang-orang yang mau mencoba dessert spesial tersebut, enggak perlu datang ke satu tempat, melainkan harus berpindah-pindah tempat (kafe) untuk mencoba semua dessert," tambah Primo.Sebuah kiriman dibagikan oleh Foodplace (@my.foodplace)Konsep ini, disebut Primo, akan mendorong pencinta dessert untuk berwisata kuliner sambil keliling kota.Jakarta Dessert Week 2024 membawa tema "Wildlife". Semua kafe maupun restoran yang berpartisipasi dalam acara ini, membuat kreasi spesial dessert dengan tema tersebut.Baca juga: 4 Tips Masak Dessert, Perhatikan Cara Menakar BahanMelalui tema tersebut, Primo berharap, kafe maupun restoran yang berpartisipasi, bisa mengangkat keanekaragaman budaya dan kekayaan alam di Indonesia melalui dessert.Selain restaurant week yang masuk dalam program city takeover, Jakarta Dessert Week 2024 juga menyiapkan acara lain.Kompas.com/Krisda Tiofani Flor, dessert shop di Jakarta Selatan yang berpartisipasi dalam Jakarta Dessert Week 2024.Acara tersebut meliputi tur dessert bersama pendiri Jakarta Dessert Week (experience tour) dan acara mingguan berupa talkshow dan demo masak bersama koki (pop up events).“Kami tengah menggodok experience tour yang rencananya akan termasuk dalam paket menginap tamu THE 1O1 Hotels and Resorts. Publik juga bisa mendaftar ke tur ini,” tutur Marcia Tirtawisata, Brand and Development THE 101 Hotels and Resorts.Baca juga: Indomilk Rilis Australian Butter Baking untuk Pelaku Usaha DessertTak hanya itu, Yuda Bustara, koki selebritas, juga menyiapkan kolaborasi Jakarta Dessert Week dengan merek keramik artisan lokal, SERO Ceramic.Kolaborasi keramik tersebut akan diluncurkan pada hari yang sama, bertepatan dengan peresmian Jakarta Dessert Week 2024 mendatang.Pengunjung Jakarta Dessert Week 2024 juga diajak mengumpulkan stempel jajan pada Stamp Card melalui pembelanjaan menu limited edition.Baca juga: 5 Tips Pilih Roti untuk French Toast, Bikin Dessert Seenak di KafeAda voucher potongan harga sebesar Rp 15.000 yang bisa digunakan untuk setiap pembelanjaan menu terbatas di aplikasi Horego. Copyright 2008 - 2024 PT. Kompas Cyber Media (Kompas Gramedia Digital Group). All Rights Reserved.
3 Festival Kuliner Akhir Pekan di Bandung, Jakarta, dan Serpong3 Festival Kuliner Akhir Pekan di Bandung, Jakarta, dan SerpongTim RedaksiKOMPAS.com - Summarecon Mall menghadirkan festival kuliner di berbagai kota yakni Bandung, Tangerang, dan Jakarta.Festival kuliner ini digelar setidaknya selama tiga minggu hingga lebih dari satu bulan sejak pertengahan Agustus 2024.Baca juga: Sasar Penggemar Makanan Pedas, Selera Sambal Tawarkan Peluang Kemitraan bagi Pengusaha KulinerKamu yang tinggal di Serpong, Bandung, atau Kelapa Gading, bisa mampir ke festival kuliner dengan tema berbeda-beda ini.Selengkapnya, simak tiga festival kuliner di Bandung, Jakarta, dan Serpong berikut ini.Summarecon Mall Bandung menghadirkan Festival Kuliner Bandung (FKB) untuk pertama kalinya sejak resmi dibuka pada awal 2024.Fetival kuliner di Bandung ini berlangsung dari Kamis (22/8/2024) hingga Senin (16/9/2024) dengan tema #JelajahKuliner Asia.Lebih dari 400 makanan asal Indonesia, Jepang, China, Thailand, Korea, bisa ditemukan di festival kuliner ini.Menu-menu khas Asia tersebut tersedia di 70 stan dan delapan truk makanan (food truck) yang tersebar dia area parkir barat Summarecon Mall Bandung.Festival Kuliner Bandung 2024 juga menghadirkan ragam karnival dan penampilan musik dari artis kenamaan tanah air yang bisa disaksikan gratis.Festival kuliner ini bisa dikunjungi setiap Senin-Kamis pukul 15.00 WIB-22.00 WIB, Jumat-Sabtu pukul 11.00 WIB-23.00 WIB, serta Minggu atau hari libur nasional pukul 11.00 WIB-22.00 WIB.Baca juga: JF3 Food Festival kembali hadir dengan cara utama berupa Kampoeng Tempo Doeloe (KTD) dan Wonderful Culinary Expo (WCE), mengusung tema "Selera Nusantara."Lebih dari 1.000 makanan dari 102 pedagang kuliner legendaris seluruh Indonesia, tersedia dalam festival kuliner ini.Ada Bebek Sinjay Bangkalan Madura Sejak 2002, Soto Kadipiro & Ingkung Pengasih Asli Jogja, Tahu Kupat Legend Asli Kota Solo, Gudeg Mercon Bu Prih, Srabi Notosuman Ny. Handayani, Pukis Telor Ayam Kampung Sumber Rezeki, dan Kupat Tahu Gempol.A post shared by Foodplace (@my.foodplace)Copyright 2008 - 2024 PT. Kompas Cyber Media (Kompas Gramedia Digital Group). All Rights Reserved.
3 Festival Kuliner Akhir Pekan di Bandung, Jakarta, dan Serpong3 Festival Kuliner Akhir Pekan di Bandung, Jakarta, dan SerpongTim RedaksiKOMPAS.com - Summarecon Mall menghadirkan festival kuliner di berbagai kota yakni Bandung, Tangerang, dan Jakarta.Festival kuliner ini digelar setidaknya selama tiga minggu hingga lebih dari satu bulan sejak pertengahan Agustus 2024.Baca juga: Sasar Penggemar Makanan Pedas, Selera Sambal Tawarkan Peluang Kemitraan bagi Pengusaha KulinerKamu yang tinggal di Serpong, Bandung, atau Kelapa Gading, bisa mampir ke festival kuliner dengan tema berbeda-beda ini.Selengkapnya, simak tiga festival kuliner di Bandung, Jakarta, dan Serpong berikut ini.Summarecon Mall Bandung menghadirkan Festival Kuliner Bandung (FKB) untuk pertama kalinya sejak resmi dibuka pada awal 2024.Fetival kuliner di Bandung ini berlangsung dari Kamis (22/8/2024) hingga Senin (16/9/2024) dengan tema #JelajahKuliner Asia.Lebih dari 400 makanan asal Indonesia, Jepang, China, Thailand, Korea, bisa ditemukan di festival kuliner ini.Menu-menu khas Asia tersebut tersedia di 70 stan dan delapan truk makanan (food truck) yang tersebar dia area parkir barat Summarecon Mall Bandung.Festival Kuliner Bandung 2024 juga menghadirkan ragam karnival dan penampilan musik dari artis kenamaan tanah air yang bisa disaksikan gratis.Festival kuliner ini bisa dikunjungi setiap Senin-Kamis pukul 15.00 WIB-22.00 WIB, Jumat-Sabtu pukul 11.00 WIB-23.00 WIB, serta Minggu atau hari libur nasional pukul 11.00 WIB-22.00 WIB.Baca juga: JF3 Food Festival kembali hadir dengan cara utama berupa Kampoeng Tempo Doeloe (KTD) dan Wonderful Culinary Expo (WCE), mengusung tema "Selera Nusantara."Lebih dari 1.000 makanan dari 102 pedagang kuliner legendaris seluruh Indonesia, tersedia dalam festival kuliner ini.Ada Bebek Sinjay Bangkalan Madura Sejak 2002, Soto Kadipiro & Ingkung Pengasih Asli Jogja, Tahu Kupat Legend Asli Kota Solo, Gudeg Mercon Bu Prih, Srabi Notosuman Ny. Handayani, Pukis Telor Ayam Kampung Sumber Rezeki, dan Kupat Tahu Gempol.A post shared by Foodplace (@my.foodplace)Copyright 2008 - 2024 PT. Kompas Cyber Media (Kompas Gramedia Digital Group). All Rights Reserved.
Curry Up, Tempat Makan Baru di SCBD untuk Pilih Kari SendiriCurry Up, Tempat Makan Baru di SCBD untuk Pilih Kari SendiriPenulisJAKARTA, KOMPAS.com - Jika biasanya tempat makan kari menghidangkan menu kari yang tidak bisa diubah komposisinya, Curry Up menyuguhkan pengalaman berbeda. Berlokasi di lantai Upper Ground di Ashta District 8, Jakarta Selatan, tempat makan yang sudah dibuka sejak Juni 2024 ini menawarkan pilihan Build-Your-Own Curry. Baca juga: 8 Ide Kreasi Ayam Goreng Tepung, Bisa Tambahkan Bumbu Kari"Curry Up menyajikan lebih dari 85 pilihan menu dari main course, juga ada curry set kita, juga ada Build-Your-Own Curry. Nanti kustomer bisa customize sendiri kari yang mau dicoba apa, berdasarkan nasinya, proteinnya, dan karinya. Lalu juga ada appetizer dan dessert," jelas CEO Erajaya Food & Nourishment, Gabrielle Halim saat acara media tasting, Selasa (20/8/2024).Sebagai informasi, Curry Up adalah merek dan concept food and beverage dari Erajaya Food & Nourishment, yang bekerja sama dengan Anders Hospitality Group, dan dioperasikan di bawah PT Era Boga Kari. Baca juga: Curry Up menyajikan menu kari yang lumayan lengkap, dari kari Jepang hingga kari India. Secara garis besar, menu rekomendasi kari yang ada di tempat makan ini, antara lain Kuriichiwa dan Omurice dari Jepang;Oh My Gaang! dari Thailand dan Indonesia; serta Long Live The King dari India.Selanjutnya ada juga Smooth Like Butter dari Thailand dan Rogan Days dari India. Harganya mulai Rp 75.000, dengan porsi yang menurut Kompas.com cukup banyak, bisa untuk dua sampai tiga orang. Baca juga:Jika memilih Build-Your-Own Curry, pengunjung bisa memilih lima saus kari yang tersedia yaitu Yellow Curry, Masala Curry, Green Curry, Brown Curry, dan Rogan Josh Curry.Kelimanya memiliki rasa dan tekstur yang berbeda. Brown Curry, misalnya, merujuk pada kari Jepang yang sedikit manis dengan tekstur kental. Sementara itu, Yellow Curry memiliki tekstur creamy dan rasa asam dari yogurt. Jika suka rasa pedas berempah dengan sedikit potongan daging kambing, bisa pilih Rogan Josh Curry. Selanjutnya pengunjung memilih nasi yang mencakup Jasmine White Rice, Yellow Aromatic Rice, Cilantro Butter Rice, Garlic Butter Rice, dan Basmati Rice. Untuk proteinnya, pengunjung bisa pilih Zesty Cheese Chicken, Chicken Katsu, Chicken Tikka, Wagyu Beef Cubes, Wagyu Beef Katsu, Duck Confit, Australian Oxtail, Lamb Cubes, Breaded Fish, Spicy Crispy Chicken, Breaded Prawns, Grilled Salmon, Australian Short Ribs, Vegetable Tempura, dan Mixed Grilled Vegetables.Dengan demikian, jika pengunjung hanya ingin makan sayur-sayuran, mereka bisa mengatur hidangan mereka sendiri. Mereka juga bisa bertanya dan minta saran ke staf yang ada.Pada awal September 2024 mendatang, Curry Up akan merilis menu baru Red Curry yang terinspirasi dari perpaduan kari India dan Inggris. Rasanya gurih dengan sedikit rasa asam dan pedas, serta tekstur creamy.Tidak hanya itu, Curry Up juga akan menerapkan spiciness level (tingkat kepedasan) untuk saus kari mereka. Tingkatnya mencakup Mild, Medium, Hot, Very Hot, dan Insanely Hot. "Rencananya kami akan membuka lebih banyak lagi cabang dan salah satunya yang paling mendekati di Mall Puri Indah di Jakarta," pungkas Gabrielle.Baca juga: Resep Kari Udang Labu Khas Thailand, Lauk Makan Siang untuk KeluargaA post shared by Foodplace (@my.foodplace)Copyright 2008 - 2024 PT. Kompas Cyber Media (Kompas Gramedia Digital Group). All Rights Reserved.
Curry Up, Tempat Makan Baru di SCBD untuk Pilih Kari SendiriCurry Up, Tempat Makan Baru di SCBD untuk Pilih Kari SendiriPenulisJAKARTA, KOMPAS.com - Jika biasanya tempat makan kari menghidangkan menu kari yang tidak bisa diubah komposisinya, Curry Up menyuguhkan pengalaman berbeda. Berlokasi di lantai Upper Ground di Ashta District 8, Jakarta Selatan, tempat makan yang sudah dibuka sejak Juni 2024 ini menawarkan pilihan Build-Your-Own Curry. Baca juga: 8 Ide Kreasi Ayam Goreng Tepung, Bisa Tambahkan Bumbu Kari"Curry Up menyajikan lebih dari 85 pilihan menu dari main course, juga ada curry set kita, juga ada Build-Your-Own Curry. Nanti kustomer bisa customize sendiri kari yang mau dicoba apa, berdasarkan nasinya, proteinnya, dan karinya. Lalu juga ada appetizer dan dessert," jelas CEO Erajaya Food & Nourishment, Gabrielle Halim saat acara media tasting, Selasa (20/8/2024).Sebagai informasi, Curry Up adalah merek dan concept food and beverage dari Erajaya Food & Nourishment, yang bekerja sama dengan Anders Hospitality Group, dan dioperasikan di bawah PT Era Boga Kari. Baca juga: Curry Up menyajikan menu kari yang lumayan lengkap, dari kari Jepang hingga kari India. Secara garis besar, menu rekomendasi kari yang ada di tempat makan ini, antara lain Kuriichiwa dan Omurice dari Jepang;Oh My Gaang! dari Thailand dan Indonesia; serta Long Live The King dari India.Selanjutnya ada juga Smooth Like Butter dari Thailand dan Rogan Days dari India. Harganya mulai Rp 75.000, dengan porsi yang menurut Kompas.com cukup banyak, bisa untuk dua sampai tiga orang. Baca juga:Jika memilih Build-Your-Own Curry, pengunjung bisa memilih lima saus kari yang tersedia yaitu Yellow Curry, Masala Curry, Green Curry, Brown Curry, dan Rogan Josh Curry.Kelimanya memiliki rasa dan tekstur yang berbeda. Brown Curry, misalnya, merujuk pada kari Jepang yang sedikit manis dengan tekstur kental. Sementara itu, Yellow Curry memiliki tekstur creamy dan rasa asam dari yogurt. Jika suka rasa pedas berempah dengan sedikit potongan daging kambing, bisa pilih Rogan Josh Curry. Selanjutnya pengunjung memilih nasi yang mencakup Jasmine White Rice, Yellow Aromatic Rice, Cilantro Butter Rice, Garlic Butter Rice, dan Basmati Rice. Untuk proteinnya, pengunjung bisa pilih Zesty Cheese Chicken, Chicken Katsu, Chicken Tikka, Wagyu Beef Cubes, Wagyu Beef Katsu, Duck Confit, Australian Oxtail, Lamb Cubes, Breaded Fish, Spicy Crispy Chicken, Breaded Prawns, Grilled Salmon, Australian Short Ribs, Vegetable Tempura, dan Mixed Grilled Vegetables.Dengan demikian, jika pengunjung hanya ingin makan sayur-sayuran, mereka bisa mengatur hidangan mereka sendiri. Mereka juga bisa bertanya dan minta saran ke staf yang ada.Pada awal September 2024 mendatang, Curry Up akan merilis menu baru Red Curry yang terinspirasi dari perpaduan kari India dan Inggris. Rasanya gurih dengan sedikit rasa asam dan pedas, serta tekstur creamy.Tidak hanya itu, Curry Up juga akan menerapkan spiciness level (tingkat kepedasan) untuk saus kari mereka. Tingkatnya mencakup Mild, Medium, Hot, Very Hot, dan Insanely Hot. "Rencananya kami akan membuka lebih banyak lagi cabang dan salah satunya yang paling mendekati di Mall Puri Indah di Jakarta," pungkas Gabrielle.Baca juga: Resep Kari Udang Labu Khas Thailand, Lauk Makan Siang untuk KeluargaA post shared by Foodplace (@my.foodplace)Copyright 2008 - 2024 PT. Kompas Cyber Media (Kompas Gramedia Digital Group). All Rights Reserved.
Kopi Kenangan Akan Buka Cabang di Filipina dan IndiaKopi Kenangan Akan Buka Cabang di Filipina dan IndiaTim RedaksiJAKARTA, KOMPAS.com - Jenama kopi kekinian Kopi Kenangan mengumumkan akan membuka cabang di Filipina dan India mulai Oktober 2024. Hal ini disampaikan saat perayaan hari jadi Kopi Kenangan ketujuh tahun."Di ulang tahun ketujuh Kopi Kenangan, kami merayakan perjalanan luar biasa yang telah membawa kami dari sebuah kedai kecil di Indonesia ke panggung internasional. Ekspansi kami ke Malaysia dan Singapura adalah bukti komitmen kami untuk menyajikan kopi berkualitas kepada lebih banyak orang di seluruh dunia," jelas Group CEO and Co-Founder of Kopi Kenangan Edward Tirtanata di Kembang Goela Restaurant, Jakarta Selatan, Selasa (27/8/2024).Baca juga: Edward melanjutkan, Filipina menjadi negara ketiga di Asia Tenggara yang akan menjadi lokasi ekspansi Kopi Kenangan. Mengingat, selera kudapan manis di Filipina serupa dengan Indonesia.Popularitas kopi fresh brew, lanjutnya, semakin meningkat di generasi muda, terutama es kopi.Dari tahun 2021 hingga 2023, penjualan kopi di Filipina tumbuh dengan Compound Annual Growth Rate (CAGR) lebih dari 20 persen.Baca juga: Direncanakan, pembukaan gerai Kopi Kenangan di Filipina akan dilakukan pada Oktober 2024 mendatang, sedangkan ekspansi Kopi Kenangan di India akan dilakukan pada awal 2025.  Konsumsi kopi di India sedang naik daun di kalangan Gen Z dan Milenial. Pertumbuhan ini juga dicerminkan dengan pertumbuhan penjualan chained cafes di India pada tahun 2020-2022 yang mencapai 29 persen.Ekspektasi pertumbuhan pasar cafe juga diprediksi akan meningkat 19 hingga 21 persen dalam kurun waktu lima tahun ke depan.“Sepak terjang tujuh tahun Kopi Kenangan di Indonesia telah berhasil menghadirkan lebih dari 900 gerai. Guna mewujudkan visi untuk menghadirkan kopi lokal berkualitas untuk seluruh lapisan masyarakat, kami menargetkan untuk memiliki 2000 gerai Kenangan Brands di Indonesia pada tahun 2027," terang Edward.Baca juga: Kopi Kenangan Luncurkan Gerai Premium Kenangan HeritageA post shared by Foodplace (@my.foodplace)Copyright 2008 - 2024 PT. Kompas Cyber Media (Kompas Gramedia Digital Group). All Rights Reserved.
Kopi Kenangan Akan Buka Cabang di Filipina dan IndiaKopi Kenangan Akan Buka Cabang di Filipina dan IndiaTim RedaksiJAKARTA, KOMPAS.com - Jenama kopi kekinian Kopi Kenangan mengumumkan akan membuka cabang di Filipina dan India mulai Oktober 2024. Hal ini disampaikan saat perayaan hari jadi Kopi Kenangan ketujuh tahun."Di ulang tahun ketujuh Kopi Kenangan, kami merayakan perjalanan luar biasa yang telah membawa kami dari sebuah kedai kecil di Indonesia ke panggung internasional. Ekspansi kami ke Malaysia dan Singapura adalah bukti komitmen kami untuk menyajikan kopi berkualitas kepada lebih banyak orang di seluruh dunia," jelas Group CEO and Co-Founder of Kopi Kenangan Edward Tirtanata di Kembang Goela Restaurant, Jakarta Selatan, Selasa (27/8/2024).Baca juga: Edward melanjutkan, Filipina menjadi negara ketiga di Asia Tenggara yang akan menjadi lokasi ekspansi Kopi Kenangan. Mengingat, selera kudapan manis di Filipina serupa dengan Indonesia.Popularitas kopi fresh brew, lanjutnya, semakin meningkat di generasi muda, terutama es kopi.Dari tahun 2021 hingga 2023, penjualan kopi di Filipina tumbuh dengan Compound Annual Growth Rate (CAGR) lebih dari 20 persen.Baca juga: Direncanakan, pembukaan gerai Kopi Kenangan di Filipina akan dilakukan pada Oktober 2024 mendatang, sedangkan ekspansi Kopi Kenangan di India akan dilakukan pada awal 2025.  Konsumsi kopi di India sedang naik daun di kalangan Gen Z dan Milenial. Pertumbuhan ini juga dicerminkan dengan pertumbuhan penjualan chained cafes di India pada tahun 2020-2022 yang mencapai 29 persen.Ekspektasi pertumbuhan pasar cafe juga diprediksi akan meningkat 19 hingga 21 persen dalam kurun waktu lima tahun ke depan.“Sepak terjang tujuh tahun Kopi Kenangan di Indonesia telah berhasil menghadirkan lebih dari 900 gerai. Guna mewujudkan visi untuk menghadirkan kopi lokal berkualitas untuk seluruh lapisan masyarakat, kami menargetkan untuk memiliki 2000 gerai Kenangan Brands di Indonesia pada tahun 2027," terang Edward.Baca juga: Kopi Kenangan Luncurkan Gerai Premium Kenangan HeritageA post shared by Foodplace (@my.foodplace)Copyright 2008 - 2024 PT. Kompas Cyber Media (Kompas Gramedia Digital Group). All Rights Reserved.
