Haus! Kenalkan Konsep Hot Oppa, Hadirkan Menu Khas KoreaHaus! Kenalkan Konsep Hot Oppa, Hadirkan Menu Khas KoreaTim RedaksiKOMPAS.com -Tampil dengan wajah baru, gerai minuman kekinian Haus! mengenalkan konsep Hot Oppa, yaitu gerai Haus! dengan nuansa khas Korea.Tidak hanya menghadirkan makanan khas Korea, dekorasi gerai Haus Hot Oppa juga instagramable dengan nuansa Korean Pop (K-Pop)."Sektor kuliner adalah salah satu sektor bisnis yang paling dinamis. Tren baru bermunculan setiap waktunya, menghadirkan beragam opsi dan tawaran berbeda bagi para konsumen," kata CEO Haus! Gufron Syarif dalam siaran resmi, Senin (22/7/2024).Baca juga: Lebih lanjut disampaikan bahwa Hot Oppa merupakan sub brand Haus! yang menawarkan aneka menu khas Korea. Harganya pun relatif terjangkau, jadi bisa dinikmati oleh seluruh kalangan.Menu Hot Oppa di gerai Haus! terdiri dari empat kategori utama, ada Noodle Soup, Fried Ramyeon, Side Dish, dan Topokki. Sebuah kiriman dibagikan oleh Foodplace (@my.foodplace)Sementara beberapa menu andalan yang wajib dicoba seperti Bone Marrow Ramyeon, Chicken Fried Ramyeon, Odeng, dan Topokki. Tingkat kepedasan ramyeon yang disajikan dengan empat level, ini bisa disesuaikan dengan selera.Baca juga: Resep Ayam Asam Manis Saus Gocujang, Lauk Praktis ala Korea"Secara konsep, restoran  Hot Oppa menawarkan suasana resto yang estetik dengan mengambil tema resto khas Korea. Pelanggan bisa menikmati aneka menu khas Korea sambil ditemani dengan lagu K-Pop terbaru," katanya.Selain menyediakan menu makan di tempat, pelanggan juga bisa mendapatkan ramyeon dalam bentuk kemasan instan.Harga makanan dan minuma yang ditawarkan di Haus! gerai Hot Oppa dibanderol mulai dari Rp 5.000 hingga Rp 25.000.Baca juga: Resep Nasi Goreng Kimchi, Masakan Simpel ala Korea SelatanSebagai bagian dari perkenalan gerai Hot Oppa, Haus! menawarkan promo menarik. Di antaranya ada paket Rp 25.000 yang terdiri dari ramyeon, telur, side dish, dan minuman.Kemudian ada diskon 10 persen untuk pembelian side dish, serta promo beli satu gratis satu untuk pelajar atau mahasiswa setiap hari Senin.Tidak hanya makanan, Haus! juga mengenalkan varian minuman terbaru, yaitu Oat Coffee Caramel Macchiato. Ini merupakan varian kopi karamel dengan tambahan susu nabati dari oat."Haus! percaya bahwa semua orang berhak untuk minum enak, termasuk minum kopi susu sebagai salah satu minuman kekinian terpopuler dengan bahan baku premium. Kami berkolaborasi dengan OATSIDE untuk menghadirkan alternatif kopi susu," kata Gufron.Ia menambahkan, minuman varian baru ini didedikasikan sebagai minuman kekinian yang sesuai dengan gaya hidup generasi muda masa kini. Dapat dikonsumsi oleh siapa saja, termasuk konsumen dengan lactose intolerance.Baca juga: Apa bedanya Oat Instan dan Rolled Oat?Varian Oat Coffee Caramel Macchiato ini disajikan dengan tambahan topping whipped cream dan saus karamel. Sehingga rasanya lebih creamy, manis, dan lembut."Minuman ini menjadi menu terbaru yang didedikasikan kepada generasi muda khususnya milenial dan Gen Z, yang telah menjadikan minum kopi sebagai sebuah gaya hidup," katanya.Ia melanjutkan bahwa tidak dipungkiri minum kopi dapat memicu kreativitas. Beberapa penelitian pun, kata Gufron, juga menujukkan bahwa kafein dapat meningkatkan fungsi kognitif dan mempengaruhi proses berpikir lateral.Baca juga: 6 Kesalahan Memilih Oat Milk yang Tidak SehatKafein, tambahnya, dapat meningkatkan neurotransmitter seperti dopamine dan neropinephrine. Keduanya dapat berperan meningkatkan mood, semangat, dan motivasi yang merupakan pemicu proses kreatif.Saat ini, varian Oat Coffee Caramel Macchiato dapat dibeli di seluruh gerai Haus! dengan harga mulai dari Rp 25.000.Copyright 2008 - 2024 PT. Kompas Cyber Media (Kompas Gramedia Digital Group). All Rights Reserved.
Haus! Kenalkan Konsep Hot Oppa, Hadirkan Menu Khas KoreaHaus! Kenalkan Konsep Hot Oppa, Hadirkan Menu Khas KoreaTim RedaksiKOMPAS.com -Tampil dengan wajah baru, gerai minuman kekinian Haus! mengenalkan konsep Hot Oppa, yaitu gerai Haus! dengan nuansa khas Korea.Tidak hanya menghadirkan makanan khas Korea, dekorasi gerai Haus Hot Oppa juga instagramable dengan nuansa Korean Pop (K-Pop)."Sektor kuliner adalah salah satu sektor bisnis yang paling dinamis. Tren baru bermunculan setiap waktunya, menghadirkan beragam opsi dan tawaran berbeda bagi para konsumen," kata CEO Haus! Gufron Syarif dalam siaran resmi, Senin (22/7/2024).Baca juga: Lebih lanjut disampaikan bahwa Hot Oppa merupakan sub brand Haus! yang menawarkan aneka menu khas Korea. Harganya pun relatif terjangkau, jadi bisa dinikmati oleh seluruh kalangan.Menu Hot Oppa di gerai Haus! terdiri dari empat kategori utama, ada Noodle Soup, Fried Ramyeon, Side Dish, dan Topokki. Sebuah kiriman dibagikan oleh Foodplace (@my.foodplace)Sementara beberapa menu andalan yang wajib dicoba seperti Bone Marrow Ramyeon, Chicken Fried Ramyeon, Odeng, dan Topokki. Tingkat kepedasan ramyeon yang disajikan dengan empat level, ini bisa disesuaikan dengan selera.Baca juga: Resep Ayam Asam Manis Saus Gocujang, Lauk Praktis ala Korea"Secara konsep, restoran  Hot Oppa menawarkan suasana resto yang estetik dengan mengambil tema resto khas Korea. Pelanggan bisa menikmati aneka menu khas Korea sambil ditemani dengan lagu K-Pop terbaru," katanya.Selain menyediakan menu makan di tempat, pelanggan juga bisa mendapatkan ramyeon dalam bentuk kemasan instan.Harga makanan dan minuma yang ditawarkan di Haus! gerai Hot Oppa dibanderol mulai dari Rp 5.000 hingga Rp 25.000.Baca juga: Resep Nasi Goreng Kimchi, Masakan Simpel ala Korea SelatanSebagai bagian dari perkenalan gerai Hot Oppa, Haus! menawarkan promo menarik. Di antaranya ada paket Rp 25.000 yang terdiri dari ramyeon, telur, side dish, dan minuman.Kemudian ada diskon 10 persen untuk pembelian side dish, serta promo beli satu gratis satu untuk pelajar atau mahasiswa setiap hari Senin.Tidak hanya makanan, Haus! juga mengenalkan varian minuman terbaru, yaitu Oat Coffee Caramel Macchiato. Ini merupakan varian kopi karamel dengan tambahan susu nabati dari oat."Haus! percaya bahwa semua orang berhak untuk minum enak, termasuk minum kopi susu sebagai salah satu minuman kekinian terpopuler dengan bahan baku premium. Kami berkolaborasi dengan OATSIDE untuk menghadirkan alternatif kopi susu," kata Gufron.Ia menambahkan, minuman varian baru ini didedikasikan sebagai minuman kekinian yang sesuai dengan gaya hidup generasi muda masa kini. Dapat dikonsumsi oleh siapa saja, termasuk konsumen dengan lactose intolerance.Baca juga: Apa bedanya Oat Instan dan Rolled Oat?Varian Oat Coffee Caramel Macchiato ini disajikan dengan tambahan topping whipped cream dan saus karamel. Sehingga rasanya lebih creamy, manis, dan lembut."Minuman ini menjadi menu terbaru yang didedikasikan kepada generasi muda khususnya milenial dan Gen Z, yang telah menjadikan minum kopi sebagai sebuah gaya hidup," katanya.Ia melanjutkan bahwa tidak dipungkiri minum kopi dapat memicu kreativitas. Beberapa penelitian pun, kata Gufron, juga menujukkan bahwa kafein dapat meningkatkan fungsi kognitif dan mempengaruhi proses berpikir lateral.Baca juga: 6 Kesalahan Memilih Oat Milk yang Tidak SehatKafein, tambahnya, dapat meningkatkan neurotransmitter seperti dopamine dan neropinephrine. Keduanya dapat berperan meningkatkan mood, semangat, dan motivasi yang merupakan pemicu proses kreatif.Saat ini, varian Oat Coffee Caramel Macchiato dapat dibeli di seluruh gerai Haus! dengan harga mulai dari Rp 25.000.Copyright 2008 - 2024 PT. Kompas Cyber Media (Kompas Gramedia Digital Group). All Rights Reserved.
Makanan Ultra Proses Sebaiknya Tidak Dikonsumsi Anak Sehat, Kenapa?Makanan Ultra Proses Sebaiknya Tidak Dikonsumsi Anak Sehat, Kenapa?PenulisKOMPAS.com - Ultra processed food (makanan ultra olahan atau UPF) sebaiknya tidak dikonsumsi anak yang sehat guna menghindari masalah kesehatan pada masa mendatang."Secara umum anak-anak sehat jauh lebih baik tidak mengkonsumsi ultra processed food maupun junk food, keduanya tidak baik bagi kesehatan anak-anak yang sehat," tutur Ketua Ikatan Dokter Anak Indonesia (IDAI), dr. Piprim Basarah Yanuarso Sp.A (K), dikutip dari Antara, Kamis (18/7/2024).Baca juga: Kaitan Makanan Ultra Proses dengan Risiko Kematian Dini dan PenyakitIa melanjutkan, makanan ultra olahan mengandung serat yang minim, dengan kalori dan gula yang tinggi. Jika dikonsumsi anak, indeks glikemik tubuh akan meningkat sehingga makanan diubah menjadi gula. Adapun gula yang berlebih di tubuh anak bisa menyebabkan ketergantungan. Tidak hanya itu, makanan ultra olahan juga membuat palate rasa anak jadi terlalu tinggi. Akibatnya, buah hati tidak mengenal rasa makanan asli. Baca juga:"Kalau anak kita mengonsumsi (ultra processed food) di pasaran bebas ini akan sangat adiktif dan over konsumsi sehingga akibatnya akan menjadi over kalori, obesitas, dan seterusnya," tutur dokter yang praktik di Rumah Sakit Cipto Mangunkusumo ini.Ia pun menyarankan untuk memberi makanan asli atau real food kepada buah hati. Misalnya buah utuh, bukannya jus dalam kemasan. Baca juga: 7 Cara Makan Fast Food agar Tetap Sehat, Perhatikan Batas KonsumsinyaPerhatikan pula asupan kalori pada anak. Batasi dalam jumlah yang cukup dan dari bahan makanan alami, antara lain daging merah atau daging unggas. Piprim juga menganjurkan orangtua untuk tidak menyediakan makanan olahan supaya tidak menimbulkan kebiasaan. Usahakan menyajikan makanan hasil masakan sendiri."Membatasi sedemikian rupa supaya di rumah atau di lemari es tidak disiapkan aneka makanan yang berupa UPF, kedua siapkanlah makanan alamiah di lemari es atau di lemari berupa buah, sayuran, telur, ikan, itu aneka olahan real food Insyaallah lebih baik," jelas dia.Baca juga: A post shared by Foodplace (@my.foodplace)Copyright 2008 - 2024 PT. Kompas Cyber Media (Kompas Gramedia Digital Group). All Rights Reserved.
Makanan Ultra Proses Sebaiknya Tidak Dikonsumsi Anak Sehat, Kenapa?Makanan Ultra Proses Sebaiknya Tidak Dikonsumsi Anak Sehat, Kenapa?PenulisKOMPAS.com - Ultra processed food (makanan ultra olahan atau UPF) sebaiknya tidak dikonsumsi anak yang sehat guna menghindari masalah kesehatan pada masa mendatang."Secara umum anak-anak sehat jauh lebih baik tidak mengkonsumsi ultra processed food maupun junk food, keduanya tidak baik bagi kesehatan anak-anak yang sehat," tutur Ketua Ikatan Dokter Anak Indonesia (IDAI), dr. Piprim Basarah Yanuarso Sp.A (K), dikutip dari Antara, Kamis (18/7/2024).Baca juga: Kaitan Makanan Ultra Proses dengan Risiko Kematian Dini dan PenyakitIa melanjutkan, makanan ultra olahan mengandung serat yang minim, dengan kalori dan gula yang tinggi. Jika dikonsumsi anak, indeks glikemik tubuh akan meningkat sehingga makanan diubah menjadi gula. Adapun gula yang berlebih di tubuh anak bisa menyebabkan ketergantungan. Tidak hanya itu, makanan ultra olahan juga membuat palate rasa anak jadi terlalu tinggi. Akibatnya, buah hati tidak mengenal rasa makanan asli. Baca juga:"Kalau anak kita mengonsumsi (ultra processed food) di pasaran bebas ini akan sangat adiktif dan over konsumsi sehingga akibatnya akan menjadi over kalori, obesitas, dan seterusnya," tutur dokter yang praktik di Rumah Sakit Cipto Mangunkusumo ini.Ia pun menyarankan untuk memberi makanan asli atau real food kepada buah hati. Misalnya buah utuh, bukannya jus dalam kemasan. Baca juga: 7 Cara Makan Fast Food agar Tetap Sehat, Perhatikan Batas KonsumsinyaPerhatikan pula asupan kalori pada anak. Batasi dalam jumlah yang cukup dan dari bahan makanan alami, antara lain daging merah atau daging unggas. Piprim juga menganjurkan orangtua untuk tidak menyediakan makanan olahan supaya tidak menimbulkan kebiasaan. Usahakan menyajikan makanan hasil masakan sendiri."Membatasi sedemikian rupa supaya di rumah atau di lemari es tidak disiapkan aneka makanan yang berupa UPF, kedua siapkanlah makanan alamiah di lemari es atau di lemari berupa buah, sayuran, telur, ikan, itu aneka olahan real food Insyaallah lebih baik," jelas dia.Baca juga: A post shared by Foodplace (@my.foodplace)Copyright 2008 - 2024 PT. Kompas Cyber Media (Kompas Gramedia Digital Group). All Rights Reserved.
Kreasi Donat dari Mi Udon Jadi Tren di JepangKreasi Donat dari Mi Udon Jadi Tren di JepangPenulisKOMPAS.com - Ada kreasi donat unik baru di Jepang, bernama Udonattsu. Sesuai namanya, donat ini mewakili kreasi mi udon menjadi donat. Kreasi donat unik ini dibuat oleh jaringan restoran udon yaitu Marugame Seimen yang dikenal pula dengan nama Marugame Udon untuk jaringan di luar negeri, termasuk Indonesia.Menurut iklan promosi untuk hidangan ini, Udonattsu memiliki tekstur kenyal yang khas.Dikutip dari Japan Today, Udonnatsu memiliki bagian luar yang  renyah dan bagian dalamnya begitu kenyal.Baca juga: Menurut pihak restoran, butuh tiga tahun untuk menyempurnakan tekstur donat yang beda dari biasa ini. Tekstur donat yang renyah dan kenyal ini tercipta dari mi udon yang dihaluskan menjadi pasta, dengan kaldu dashi putih sehingga menambah aroma dan rasa yang menggugah selera. Disebutkan Japan Today, donat ini adalah ide yang inovatif karena membuat donat dengan mi udon yang dibuat jadi pasta, alih-alih memakai tepung udon.Udonattsu hanya tersedia di beberapa lokasi Marugame Seimen tertentu di Jepang, dengan peluncuran mulai 25 Juni 2024.Saar ini Udonnatsu dijual dengan topping gula dan kari dan dijual dengan harga 300 yen atau setara Rp 30.000 untuk satu kantung berisi lima donat. Tertarik coba? Baca juga:A post shared by Foodplace (@my.foodplace)Copyright 2008 - 2024 PT. Kompas Cyber Media (Kompas Gramedia Digital Group). All Rights Reserved.
Menggugat "Gastro-Colonialism"Menggugat "Gastro-Colonialism"Food engineer; R&D manager–multinational food corporation (2009 – 2019); Pemerhati masalah nutrisi dan kesehatan.BANYAK di antara kita yang pernah mendengar istilah gastronomi maupun gastrokolonialisme. Namun, hanya sedikit yang benar-benar mengerti dan memahami dampak dari gastrokolonialisme atau penjajahan pangan.Sebuah terminologi untuk menggambarkan kondisi di mana masyarakat luas tidak menyadari telah dikuasai dan dikendalikan oleh pangan ultra-olahan.Pola konsumsi serta preferensi makanan masyarakat telah didominasi sedemikian rupa oleh produk-produk pangan ultra-olahan, yang umumnya tinggi kalori, gula, garam, lemak, dan cenderung tidak sehat, diproduksi secara massal oleh korporasi industri berskala besar.Pelan tapi pasti menggeser makanan lokal serta pola makan tradisional yang sejatinya lebih sehat. Sebuah bentuk penjajahan modern dan amat rapi dalam aspek makanan, ekonomi, budaya sekaligus kesehatan masyarakat.Namun, benarkah masih ada penjajahan (pangan) di era kemerdekaan ini? Mengapa umumnya tidak dirasakan atau dikeluhkan masyarakat? Lantas apa bahayanya?Craig Santos Perez, seorang peneliti dan aktivis dari Guam, memperkenalkan istilah gastrokolonialisme untuk menggambarkan penjajahan pangan di Hawaii, di mana ketergantungan pada produk pangan ultra-olahan impor mengurangi status gizi masyarakat yang sebelumnya mengonsumsi pangan lokal yang jauh lebih bergizi.Kondisi serupa terjadi di Merauke, Papua, yang sebelumnya memiliki sumber pangan lokal bergizi seperti sagu dan ubi, tetapi kini mulai tergeser oleh konsumsi pangan ultra-olahan, terutama beras dan gandum, yang mengarah pada ketergantungan dan kontrol pangan oleh produsen makanan besar.Sophie Chao (2021) menjelaskan fenomena ini dalam artikel "Gastrocolonialism: The Intersections of Race, Food, and Development in West Papua."Dalam konteks kekinian yang berlaku untuk masyarakat lainnya yang lebih luas, perusahaan besar melanggengkan kontrol tersebut, dengan menggunakan senjata berupa kesadaran palsu (false consciousness), yang diciptakan dan terus ditanamkan dalam benak konsumen melalui iklan dan pemasaran yang sangat masif dan agresif.Kesadaran palsu merupakan konsep dan situasi di mana masyarakat konsumen tidak menyadari kepentingan nyata dan hak mereka terhadap pangan sehat, namun justru menerima pandangan yang seolah-olah benar, yang sesungguhnya hanya menguntungkan kaum pengusaha semata.Dalam kasus kolonialisme pangan, kesadaran palsu muncul ketika masyarakat, melalui kampanye pemasaran pangan yang menampilkan produk ultra-olahan sebagai pilihan modern, sehat, dan praktis, percaya bahwa produk tersebut baik dan tidak berbahaya.Iklan-iklan ini mengaitkan produk dengan gaya hidup ideal, menyembunyikan dampak negatif jangka panjangnya, sehingga masyarakat tanpa sadar mengadopsi kebiasaan makan yang dikendalikan oleh perusahaan besar.Pada akhirnya merusak kesehatan, budaya, dan kemandirian pangan mereka, membentuk penjajahan yang amat halus dan samar melalui kontrol atas pikiran dan pilihan konsumen.Ternyata benar, apa yang kita makan bukanlah sekadar pilihan pribadi yang sepenuhnya bebas merdeka.Marion Nestle, penulis buku “Unsavory Truth: How the Food Industry Skews the Science of What We Eat,” menjelaskan bagaimana sebagian dari para raksasa global perusahaan makanan dan minuman memproduksi dan memasarkan makanan mereka dengan bias ilmu pengetahuan di baliknya.Copyright 2008 - 2024 PT. Kompas Cyber Media (Kompas Gramedia Digital Group). All Rights Reserved.
Kreasi Donat dari Mi Udon Jadi Tren di JepangKreasi Donat dari Mi Udon Jadi Tren di JepangPenulisKOMPAS.com - Ada kreasi donat unik baru di Jepang, bernama Udonattsu. Sesuai namanya, donat ini mewakili kreasi mi udon menjadi donat. Kreasi donat unik ini dibuat oleh jaringan restoran udon yaitu Marugame Seimen yang dikenal pula dengan nama Marugame Udon untuk jaringan di luar negeri, termasuk Indonesia.Menurut iklan promosi untuk hidangan ini, Udonattsu memiliki tekstur kenyal yang khas.Dikutip dari Japan Today, Udonnatsu memiliki bagian luar yang  renyah dan bagian dalamnya begitu kenyal.Baca juga: Menurut pihak restoran, butuh tiga tahun untuk menyempurnakan tekstur donat yang beda dari biasa ini. Tekstur donat yang renyah dan kenyal ini tercipta dari mi udon yang dihaluskan menjadi pasta, dengan kaldu dashi putih sehingga menambah aroma dan rasa yang menggugah selera. Disebutkan Japan Today, donat ini adalah ide yang inovatif karena membuat donat dengan mi udon yang dibuat jadi pasta, alih-alih memakai tepung udon.Udonattsu hanya tersedia di beberapa lokasi Marugame Seimen tertentu di Jepang, dengan peluncuran mulai 25 Juni 2024.Saar ini Udonnatsu dijual dengan topping gula dan kari dan dijual dengan harga 300 yen atau setara Rp 30.000 untuk satu kantung berisi lima donat. Tertarik coba? Baca juga:A post shared by Foodplace (@my.foodplace)Copyright 2008 - 2024 PT. Kompas Cyber Media (Kompas Gramedia Digital Group). All Rights Reserved.
Resep Tahu Gejrot Praktis, Cukup 2 Langkah MasakResep Tahu Gejrot Praktis, Cukup 2 Langkah MasakPenulisTim Boga FeminaPemulaKOMPAS.com - Tahu gejrot wajib dicoba jika sedang ingin makan camilan yang manis, pedas, dan sedikit asam. Aromanya yang khas pun menggugah selera. Untuk resep ini, pakailah tahu sumedang yang sudah digoreng. Selanjutnya potong tahu tersebut sesuai selera. Berikut resep dan cara membuat tahu gejrot, dikutip dari buku "Seri Masak Femina-Dapur Utama: Jajanan Enak 2 - Serba Tahu & Warung Cina" karya Tim Boga Femina (2019) terbitan PT Gaya Favorit Press.Baca juga: Baca juga: A post shared by Foodplace (@my.foodplace)Copyright 2008 - 2024 PT. Kompas Cyber Media (Kompas Gramedia Digital Group). All Rights Reserved.
5 Tips Bikin Masakan Berkuah Makin Sedap, Perhatikan Bumbu Dasar5 Tips Bikin Masakan Berkuah Makin Sedap, Perhatikan Bumbu DasarPenulisKOMPAS.com - Masakan berkuah sering menjadi pilihan favorit, terutama saat cuaca dingin atau ketika mencari hidangan yang nyaman di perut.Proses memasaknya pun relatif mudah dan praktis karena semua bahan cukup dimasukkan ke dalam cairan seperti air, kaldu, susu, atau santan, dan direbus hingga matang.Namun, ada beberapa trik sederhana yang bisa kamu terapkan agar masakan berkuah tidak hanya matang dengan baik, tetapi juga lebih sedap dan kaya rasa.Dilansir dari buku "Masakan Rumahan Tumis, Kuah, Goreng" (2014) oleh Endang Indriani terbitan Kawan Pustaka ini, kamu akan menemukan tips-tips mudah untuk membuat masakan berkuah semakin lezat.Baca juga:  Masakan berkuah seperti sup sayuran, pho, atau mi rebus akan lebih sedap jika menggunakan kaldu buatan sendiri. Kaldu buatan sendiri bukan hanya lebih nikmat, tetapi juga lebih sehat karena kamu tahu pasti bahan-bahan yang digunakan.Cara membuatnya mudah, cukup dengan merebus tulang sapi, tetelan, atau tulang ayam bersama bumbu aromatik seperti bawang putih, bawang bombai, dan daun bawang.Rebus dengan api kecil selama minimal dua jam untuk mendapatkan kaldu yang kaya rasa dan berwarna kekuningan.Sering kali kita tergoda untuk memasak dengan api besar agar masakan cepat matang, terutama untuk bahan seperti daging.Padahal, memasak dengan api kecil dan perlahan justru membuat daging lebih empuk dan bumbu meresap lebih sempurna. Proses ini juga memastikan kuah masakan tidak terlalu cepat menguap sehingga rasa tetap terjaga.Bumbu seperti bawang putih, bawang merah, dan cabai sebaiknya ditumis terlebih dahulu hingga harum sebelum cairan seperti air atau kaldu dimasukkan.Menumis bumbu ini akan memberikan rasa yang lebih mendalam pada masakanmu. Bumbu yang sudah matang dan kecokelatan akan menghasilkan aroma yang kuat dan rasa yang lebih gurih.Saat memasak masakan berkuah, pastikan bahan-bahan seperti sayuran dan daging dipotong dengan ukuran yang seragam.Potongan yang sama ukurannya akan membuat semua bahan matang secara bersamaan, sehingga kamu tidak akan menemukan bagian yang terlalu matang atau malah belum matang.Jika kamu menggunakan bahan-bahan yang bertekstur berbeda, seperti daging dan sayuran, pastikan untuk memasukkan bahan secara bertahap.Mulailah dengan bahan yang membutuhkan waktu lebih lama untuk matang, seperti daging atau kentang, dan akhiri dengan bahan yang cepat matang seperti sayuran hijau.Dengan cara ini, semua bahan akan matang dengan sempurna tanpa ada yang terlalu lembek atau keras.Sebuah kiriman dibagikan oleh Kompas.com (@kompascom)Copyright 2008 - 2024 PT. Kompas Cyber Media (Kompas Gramedia Digital Group). All Rights Reserved.
Resep Pizza Teflon Antigagal, Rasa Bintang LimaResep Pizza Teflon Antigagal, Rasa Bintang LimaPenulisDelishPemulaKOMPAS.com - Pizza teflon adalah solusi praktis untuk menikmati pizza lezat ala restoran tanpa oven.Dengan bahan-bahan yang sederhana dan metode yang mudah, resep pizza teflon ini cocok untuk pemula sekalipun.Hasilnya, pizza dengan tekstur empuk dan lembut yang tak kalah dengan pizza bintang lima. Ingin tahu cara membuat pizza teflon rumahan yang anti gagal?Simak cara bikin pizza teflon berikut ini dan ciptakan pizza ala Pizza Hut di rumah, dilansir dari laman Delish. Baca juga: Untuk Saus TomatSebuah kiriman dibagikan oleh Foodplace (@my.foodplace)Copyright 2008 - 2024 PT. Kompas Cyber Media (Kompas Gramedia Digital Group). All Rights Reserved.
10 Gorengan Manis Laris Manis, Inspirasi Jualan Depan Rumah10 Gorengan Manis Laris Manis, Inspirasi Jualan Depan RumahPenulisKOMPAS.com - Gorengan manis selalu menjadi camilan favorit di berbagai kesempatan. Dari pisang goreng hingga tape goreng, setiap gigitan menawarkan rasa manis yang bikin ketagihan.Selain nikmat, gorengan manis juga bisa menjadi peluang usaha yang menjanjikan. Jika kamu mencari ide jualan yang mudah dan laris manis, berikut 10 gorengan manis yang bisa kamu coba.Selain bahannya yang mudah didapat, resep-resep ini pasti diminati banyak orang. Baca juga: Pisang goreng adalah gorengan yang tak pernah sepi peminat. Pisang dibalut adonan tepung lalu digoreng hingga renyah. Jenis pisang seperti kepok, tanduk, dan uli memberikan variasi rasa yang unik.Ubi goreng memiliki rasa manis alami yang sempurna saat dipadukan dengan tepung renyah. Gunakan ubi oranye atau kuning untuk hasil yang lebih manis dan menggugah selera.Tape goreng memiliki kombinasi rasa manis dan asam dari tape singkong yang dibalut tepung dan digoreng. Rasanya unik dan selalu jadi favorit.Gandasturi terbuat dari kacang hijau yang dihancurkan lalu digoreng dengan adonan tepung. Teksturnya lembut dan manis, cocok untuk menemani secangkir teh hangat.Misro berbahan dasar singkong yang diisi gula merah. Saat digoreng, gula merah meleleh di dalamnya, memberikan sensasi manis dan gurih dalam satu gigitan.Getuk goreng terbuat dari singkong yang dihaluskan dan dibalut dengan gula merah cair sebelum digoreng. Teksturnya kenyal di dalam dan renyah di luar.Gemblong adalah jajanan khas dengan bahan dasar beras ketan yang digoreng dan dilapisi gula merah cair. Rasanya manis, dengan tekstur lembut di dalam.Pisang molen menggunakan pisang yang dibalut dengan kulit pastry tipis sebelum digoreng. Rasanya manis dan gurih, pas untuk camilan atau ide jualan.Timus atau katimus berbahan dasar singkong parut yang dicampur dengan kelapa dan gula merah. Rasanya manis dan legit, dengan tekstur lembut yang memanjakan lidah.Pisang aroma dibungkus dengan kulit lumpia tipis dan diberi tambahan gula serta tepung terigu sebelum digoreng. Rasanya renyah dan manis, sangat populer sebagai jajanan jalanan.Sebuah kiriman dibagikan oleh Foodplace (@my.foodplace)Copyright 2008 - 2024 PT. Kompas Cyber Media (Kompas Gramedia Digital Group). All Rights Reserved.
Resep Kwetiau Goreng, Pakai Ebi Lebih GurihResep Kwetiau Goreng, Pakai Ebi Lebih GurihPenulisTim Dapur DeMediaPemulaKOMPAS.com - Jika punya kwetiau kering di rumah, masaklah menjadi kwetiau goreng. Kwetiau kering umumnya tahan lebih lama dibanding kwetiau basah, tapi harus direbus terlebih dahulu sebelum diolah menjadi masakan.Dikutip dari buku "Aneka Masakan Mi, Bihun, dan Kwetiau Populer" karya Tim Dapur Demedia (2010) terbitan Demedia Pustaka, berikut resep dan cara membuat kwetiau goreng.Baca juga:Baca juga: A post shared by Foodplace (@my.foodplace)Copyright 2008 - 2024 PT. Kompas Cyber Media (Kompas Gramedia Digital Group). All Rights Reserved.
