5 Tips Bikin Masakan Berkuah Makin Sedap, Perhatikan Bumbu Dasar5 Tips Bikin Masakan Berkuah Makin Sedap, Perhatikan Bumbu DasarPenulisKOMPAS.com - Masakan berkuah sering menjadi pilihan favorit, terutama saat cuaca dingin atau ketika mencari hidangan yang nyaman di perut.Proses memasaknya pun relatif mudah dan praktis karena semua bahan cukup dimasukkan ke dalam cairan seperti air, kaldu, susu, atau santan, dan direbus hingga matang.Namun, ada beberapa trik sederhana yang bisa kamu terapkan agar masakan berkuah tidak hanya matang dengan baik, tetapi juga lebih sedap dan kaya rasa.Dilansir dari buku "Masakan Rumahan Tumis, Kuah, Goreng" (2014) oleh Endang Indriani terbitan Kawan Pustaka ini, kamu akan menemukan tips-tips mudah untuk membuat masakan berkuah semakin lezat.Baca juga:  Masakan berkuah seperti sup sayuran, pho, atau mi rebus akan lebih sedap jika menggunakan kaldu buatan sendiri. Kaldu buatan sendiri bukan hanya lebih nikmat, tetapi juga lebih sehat karena kamu tahu pasti bahan-bahan yang digunakan.Cara membuatnya mudah, cukup dengan merebus tulang sapi, tetelan, atau tulang ayam bersama bumbu aromatik seperti bawang putih, bawang bombai, dan daun bawang.Rebus dengan api kecil selama minimal dua jam untuk mendapatkan kaldu yang kaya rasa dan berwarna kekuningan.Sering kali kita tergoda untuk memasak dengan api besar agar masakan cepat matang, terutama untuk bahan seperti daging.Padahal, memasak dengan api kecil dan perlahan justru membuat daging lebih empuk dan bumbu meresap lebih sempurna. Proses ini juga memastikan kuah masakan tidak terlalu cepat menguap sehingga rasa tetap terjaga.Bumbu seperti bawang putih, bawang merah, dan cabai sebaiknya ditumis terlebih dahulu hingga harum sebelum cairan seperti air atau kaldu dimasukkan.Menumis bumbu ini akan memberikan rasa yang lebih mendalam pada masakanmu. Bumbu yang sudah matang dan kecokelatan akan menghasilkan aroma yang kuat dan rasa yang lebih gurih.Saat memasak masakan berkuah, pastikan bahan-bahan seperti sayuran dan daging dipotong dengan ukuran yang seragam.Potongan yang sama ukurannya akan membuat semua bahan matang secara bersamaan, sehingga kamu tidak akan menemukan bagian yang terlalu matang atau malah belum matang.Jika kamu menggunakan bahan-bahan yang bertekstur berbeda, seperti daging dan sayuran, pastikan untuk memasukkan bahan secara bertahap.Mulailah dengan bahan yang membutuhkan waktu lebih lama untuk matang, seperti daging atau kentang, dan akhiri dengan bahan yang cepat matang seperti sayuran hijau.Dengan cara ini, semua bahan akan matang dengan sempurna tanpa ada yang terlalu lembek atau keras.Sebuah kiriman dibagikan oleh Kompas.com (@kompascom)Copyright 2008 - 2024 PT. Kompas Cyber Media (Kompas Gramedia Digital Group). All Rights Reserved.
Resep Pizza Teflon Antigagal, Rasa Bintang LimaResep Pizza Teflon Antigagal, Rasa Bintang LimaPenulisDelishPemulaKOMPAS.com - Pizza teflon adalah solusi praktis untuk menikmati pizza lezat ala restoran tanpa oven.Dengan bahan-bahan yang sederhana dan metode yang mudah, resep pizza teflon ini cocok untuk pemula sekalipun.Hasilnya, pizza dengan tekstur empuk dan lembut yang tak kalah dengan pizza bintang lima. Ingin tahu cara membuat pizza teflon rumahan yang anti gagal?Simak cara bikin pizza teflon berikut ini dan ciptakan pizza ala Pizza Hut di rumah, dilansir dari laman Delish. Baca juga: Untuk Saus TomatSebuah kiriman dibagikan oleh Foodplace (@my.foodplace)Copyright 2008 - 2024 PT. Kompas Cyber Media (Kompas Gramedia Digital Group). All Rights Reserved.
10 Gorengan Manis Laris Manis, Inspirasi Jualan Depan Rumah10 Gorengan Manis Laris Manis, Inspirasi Jualan Depan RumahPenulisKOMPAS.com - Gorengan manis selalu menjadi camilan favorit di berbagai kesempatan. Dari pisang goreng hingga tape goreng, setiap gigitan menawarkan rasa manis yang bikin ketagihan.Selain nikmat, gorengan manis juga bisa menjadi peluang usaha yang menjanjikan. Jika kamu mencari ide jualan yang mudah dan laris manis, berikut 10 gorengan manis yang bisa kamu coba.Selain bahannya yang mudah didapat, resep-resep ini pasti diminati banyak orang. Baca juga: Pisang goreng adalah gorengan yang tak pernah sepi peminat. Pisang dibalut adonan tepung lalu digoreng hingga renyah. Jenis pisang seperti kepok, tanduk, dan uli memberikan variasi rasa yang unik.Ubi goreng memiliki rasa manis alami yang sempurna saat dipadukan dengan tepung renyah. Gunakan ubi oranye atau kuning untuk hasil yang lebih manis dan menggugah selera.Tape goreng memiliki kombinasi rasa manis dan asam dari tape singkong yang dibalut tepung dan digoreng. Rasanya unik dan selalu jadi favorit.Gandasturi terbuat dari kacang hijau yang dihancurkan lalu digoreng dengan adonan tepung. Teksturnya lembut dan manis, cocok untuk menemani secangkir teh hangat.Misro berbahan dasar singkong yang diisi gula merah. Saat digoreng, gula merah meleleh di dalamnya, memberikan sensasi manis dan gurih dalam satu gigitan.Getuk goreng terbuat dari singkong yang dihaluskan dan dibalut dengan gula merah cair sebelum digoreng. Teksturnya kenyal di dalam dan renyah di luar.Gemblong adalah jajanan khas dengan bahan dasar beras ketan yang digoreng dan dilapisi gula merah cair. Rasanya manis, dengan tekstur lembut di dalam.Pisang molen menggunakan pisang yang dibalut dengan kulit pastry tipis sebelum digoreng. Rasanya manis dan gurih, pas untuk camilan atau ide jualan.Timus atau katimus berbahan dasar singkong parut yang dicampur dengan kelapa dan gula merah. Rasanya manis dan legit, dengan tekstur lembut yang memanjakan lidah.Pisang aroma dibungkus dengan kulit lumpia tipis dan diberi tambahan gula serta tepung terigu sebelum digoreng. Rasanya renyah dan manis, sangat populer sebagai jajanan jalanan.Sebuah kiriman dibagikan oleh Foodplace (@my.foodplace)Copyright 2008 - 2024 PT. Kompas Cyber Media (Kompas Gramedia Digital Group). All Rights Reserved.
Resep Kwetiau Goreng, Pakai Ebi Lebih GurihResep Kwetiau Goreng, Pakai Ebi Lebih GurihPenulisTim Dapur DeMediaPemulaKOMPAS.com - Jika punya kwetiau kering di rumah, masaklah menjadi kwetiau goreng. Kwetiau kering umumnya tahan lebih lama dibanding kwetiau basah, tapi harus direbus terlebih dahulu sebelum diolah menjadi masakan.Dikutip dari buku "Aneka Masakan Mi, Bihun, dan Kwetiau Populer" karya Tim Dapur Demedia (2010) terbitan Demedia Pustaka, berikut resep dan cara membuat kwetiau goreng.Baca juga:Baca juga: A post shared by Foodplace (@my.foodplace)Copyright 2008 - 2024 PT. Kompas Cyber Media (Kompas Gramedia Digital Group). All Rights Reserved.
Resep Klepon, Ide Camilan Tradisional dengan Daun Suji Resep Klepon, Ide Camilan Tradisional dengan Daun Suji PenulisDapur LestariMenengahKOMPAS.com - Klepon termasuk kue tradisional yang mudah ditemui, dari pasar tradisional hingga pasar swalayan. Warna hijau khas klepon bisa didapat baik dari pewarna hijau maupun daun suji. Kali ini cobalah membuat klepon dari daun suji. Simak resep klepon berikut ini, dilansir dari buku "101 Kue Nusantara" karya Dapur Kirana (2013) terbitan Kriya Pustaka.Baca juga:Baca juga: A post shared by Foodplace (@my.foodplace)Copyright 2008 - 2024 PT. Kompas Cyber Media (Kompas Gramedia Digital Group). All Rights Reserved.
Resep Strawberry Milk ala Korea, Minuman Segar yang Bikin HappyResep Strawberry Milk ala Korea, Minuman Segar yang Bikin HappyPenulisNDTVPemula KOMPAS.com - Strawberry Milk ala Korea adalah minuman segar yang belakangan ini populer di media sosial. Dengan kombinasi potongan stroberi segar dan susu creamy, minuman ini tidak hanya cantik secara visual, tetapi juga menyegarkan dan bikin happy.Cara membuat strawberry milk ini sangat mudah, cocok untuk dinikmati di rumah atau menjadi minuman favorit saat bersantai.Yuk, coba buat es strawberry milk yang segar dan creamy dengan resep milk strawberry ala Korea ini, dilansir dari laman NDTV berikut ini.Baca juga: BahanSebuah kiriman dibagikan oleh Foodplace (@my.foodplace)Copyright 2008 - 2024 PT. Kompas Cyber Media (Kompas Gramedia Digital Group). All Rights Reserved.
Nasi Gandul Khas Pati Ditetapkan Sebagai Warisan Budaya TakbendaNasi Gandul Khas Pati Ditetapkan Sebagai Warisan Budaya TakbendaTim RedaksiPATI, KOMPAS.com - Sego atau nasi gandul, kuliner khas Kabupaten Pati, Jawa Tengah, ditetapkan sebagai peninggalan Warisan Budaya Takbenda (WBTb) Indonesia oleh Kementerian Pendidikan, Kebudayaan, Riset, dan Teknologi (Kemdikbudristek).Plt Kepala Dinas Pendidikan dan Kebudayaan (Disdikbud) Pati, Tulus Budiharjo, menyampaikan, legalisasi nasi gandul menjadi WBTb dilaksanakan usai digelarnya sidang ratifikasi yang hasilnya dibacakan di Jakarta, Kamis (22/8/2024). Nasi gandul membuktikan kelestarian budaya hidup dari kearifan lokal Kabupaten Pati yang diturunkan dari generasi ke generasi dalam arus tradisi.Baca juga: Resep Nasi Gandul Khas Pati, Ide Sarapan dari Daging Kurban"Alhamdulillah sego gandul resmi tercatat Warisan Budaya Takbenda Indonesia domain keterampilan dan kemahiran kerajinan tradisional. Kami datang diundang ke Jakarta," kata Tulus saat dihubungi melalui ponsel, Rabu (11/9/2024).Menurut Tulus, pencapaian ini merupakan ganjaran tak ternilai untuk masyarakat Pati, termasuk Disdikbud Pati yang berkontribusi memperjuangkan identitas makanan tradisional di wilayahnya. Sebuah kiriman dibagikan oleh Foodplace (@my.foodplace)Sejatinya, sambung Tulus, esensi dari puncak status budaya takbenda adalah upaya perlindungan sekaligus memperkenalkan nasi gandul kepada nusantara hingga dunia. Sehingga, tidak berujung diklaim oleh daerah atau bahkan negara lain."Sego gandul adalah karya budaya peninggalan leluhur Kabupaten Pati ratusan tahun silam yang bukan cuma katanya tapi bisa dibuktikan," terang Tulus.Dijelaskan Tulus, proses melambungkan nama sego gandul menuju predikat WBTb membutuhkan waktu yang tak singkat. Pengusulan WBTb ke UNESCO dilakukan oleh Disdikbud Pati kepada Kemdikbudristek setelah sebelumnya diseleksi Disdikbud Provinsi Jateng.Baca juga: Sejarah Nasi Gandul Khas Pati, Konon Dulu Penjualnya Berkepala GundulDasar hukum penominasian WBTb di antaranya yaitu Undang-Undang Nomor 28 Tahun 2014 tetang Hak Cipta (Lembaran Negara Republik Indonesia Tahun 2014 Nomor 266, Tambahan Lembaran Negara Republik Indonesia Nomor 5599).Kemudian Peraturan Presiden Republik Indonesia Nomor 78 Tahun 2007 tentang Pengesahan Convention for the Safeguarding of the Intangible Cultural Heritage UNESCO Tahun 2003 (Konvensi untuk Perlindungan Warisan Budaya Takbenda) serta Peraturan Menteri Pendidikan dan Kebudayaan Nomor 106 Tahun 2013 tentang Warisan Budaya Takbenda Indonesia"Diajukan sejak 2020. Kami persiapkan dokumen menyoal sego gandul di antaranya latar belakang, sejarah, dan kajian akademis," kata Tulus.Baca juga: Resep Nasi Gandul Pati, Inspirasi Masakan Gio MasterChef IndonesiaDahulu, kata Tulus, salah satu entitas yang memopulerkan nasi gandul di Pati yakni mendiang Pak Meled. Ia dan istrinya, Sukini meracik sendiri resepnya dan berjualan berkeliling perkotaan Pati mulai malam.Mayoritas pelanggannya orang-orang etnis Tionghoa yang duduk berjongkok mengelilingi dagangan Pak Meled yang dipikul.Sego gandul adalah nasi dengan irisan lauk empal atau daging sapi bacem, jeroan yang disiram kuah bersantan, berempah, kecap dan bersambal cabai rawit rebus. Disajikan dipincuk dengan daun pisang atau piring beralaskan daun pisang yang disebut samir.Masakan lezat itu dulunya hanya dikonsumsi kaum elite lantaran bahan dasar daging sapi cukup mahal bagi penduduk lokal.Perkembangannya, sego gandul menjadi menu masakan tradisional yang dihidangkan di hajatan dan sudah dinikmati berbagai kalangan. Penjaja nasi gandul pun berkembang pesat dan tersebar luas di Pati.Baca juga: Resep Nasi Gandul Khas Pati, Dihidangkan dengan Lauk Daging Kerbau"Pelanggan para etnis Tionghoa dulunya yang menamai nasi gandul karena dijual dipikul dan gondal-gandul atau bergoyang-goyang. Selain itu cara menghidangkan menggunakan daun di atas piring sehingga menggantung dan dinamakan sego gandul," pungkas Tulus.Artikel ini merupakan bagian dari Lestari KG Media, sebuah inisiatif untuk akselerasi Tujuan Pembangunan            Berkelanjutan.            SelengkapnyaCopyright 2008 - 2024 PT. Kompas Cyber Media (Kompas Gramedia Digital Group). All Rights Reserved.
Resep Thai Tea Segar ala Kedai, Segarnya Bikin KetagihanResep Thai Tea Segar ala Kedai, Segarnya Bikin KetagihanPenulisDelishPemulaKOMPAS.com - Es Thai Tea adalah salah satu minuman yang populer di berbagai kedai, terutama saat cuaca panas.Dengan rasa khas teh Thailand yang manis dan creamy, minuman ini menjadi favorit banyak orang. Tidak perlu repot pergi ke kedai karena kini Anda bisa mencoba cara membuat Thai Tea simpel di rumah.Bahan Thai Tea yang digunakan juga mudah ditemukan, menjadikan resep ini cocok untuk dinikmati sendiri ataupun sebagai minuman andalan untuk jualan.Simak cara buat Thai Tea ala kedai yang segarnya bikin ketagihan, dilansir dari laman Delish. Baca juga: BahanSebuah kiriman dibagikan oleh Foodplace (@my.foodplace)Copyright 2008 - 2024 PT. Kompas Cyber Media (Kompas Gramedia Digital Group). All Rights Reserved.
5 Cara Membuat Smoothie yang Bikin Kenyang Seharian5 Cara Membuat Smoothie yang Bikin Kenyang SeharianPenulisKOMPAS.com - Smoothie bukan hanya minuman segar yang kaya akan vitamin, tetapi juga bisa menjadi pilihan sarapan yang mengenyangkan dan menyehatkan.Namun, kunci dari smoothie yang bisa membuat kamu kenyang seharian adalah dengan menambahkan beberapa bahan penting yang akan memberikan energi lebih lama.Kombinasi bahan yang tepat akan membuat smoothie tidak hanya lezat, tetapi juga mampu menahan rasa lapar lebih lama.Di artikel ini, kamu akan menemukan lima cara mudah untuk membuat smoothie yang mengenyangkan dan bergizi, dilansir dari laman The Kitchn. Baca juga: Selai kacang, seperti selai almond atau selai kacang tanah, merupakan tambahan yang kaya protein untuk smoothie-mu. Selain memberikan tekstur yang lebih kental, protein dari selai kacang membantu tubuh merasa kenyang lebih lama.Cobalah tambahkan satu sendok makan selai almond ke dalam smoothie pisang dengan yogurt tawar, susu almond, madu, dan es. Kombinasi ini akan membuat smoothie-mu tidak hanya enak, tetapi juga padat gizi.Chia seeds adalah superfood yang kaya akan protein dan antioksidan. Menambahkan 1-2 sendok makan chia seeds ke dalam smoothie akan memberikan tambahan nutrisi yang signifikan.Meski kamu bisa langsung mencampurkannya, chia seeds sering kali sulit tercampur sempurna dan dapat membuat smoothie terlalu kental.Sebaiknya, rendam chia seeds dalam air selama sekitar 10 menit sebelum dicampur, sehingga teksturnya lebih mudah menyatu dengan smoothie.Yogurt Yunani yang kaya protein, adalah kunci untuk membuat smoothie yang memuaskan.Yogurt penuh lemak membantu kamu merasa kenyang lebih lama, apalagi jika kamu menggunakan varian tawar yang rendah gula. Biarkan buah dalam smoothie memberikan rasa alami tanpa perlu menambahkan gula tambahan.Dengan begitu, kamu mendapatkan smoothie yang tidak hanya sehat, tetapi juga mampu memberikan energi tahan lama.Lemak sehat membantu tubuh merasa kenyang lebih lama, terutama di pagi hari. Cobalah tambahkan sedikit minyak kelapa ke dalam smoothie-mu.Minyak kelapa memiliki rasa manis yang halus dan memberikan tekstur lembut pada smoothie. Alternatif lainnya, kamu bisa menggunakan alpukat atau kacang mete.Lemak sehat ini membantu kamu menjalani pagi hari dengan fokus, tanpa merasa lapar sebelum waktu makan siang tiba.Sebuah kiriman dibagikan oleh Kompas.com (@kompascom) Copyright 2008 - 2024 PT. Kompas Cyber Media (Kompas Gramedia Digital Group). All Rights Reserved.
Resep Cake Spons Klasik 3 BahanResep Cake Spons Klasik 3 BahanPenulisAryuni Dianning WatiPemulaKOMPAS.com - Cake spons klasik selalu punya tempat istimewa di hati banyak orang. Dengan teksturnya yang lembut dan ringan, kue ini cocok untuk segala suasana, entah itu sebagai teman minum teh di sore hari atau sebagai hidangan penutup yang manis.Meski tampilannya sederhana, cake spons punya cita rasa yang tidak main-main. Apalagi kalau dipadukan dengan topping seperti buah segar, krim lembut, atau selai favorit.Cake ini bisa dibuat dengan hanya tiga bahan saja, membuatnya super praktis dan cocok untuk siapa saja yang baru mulai belajar bikin kue, hal yang paling menyenangkan.Cukup siapkan telur, gula kastor, dan tepung terigu untuk membuat cake spons klasik ini. Tanpa perlu repot menambahkan bahan pengembang, cake ini mengandalkan kocokan telur yang pas untuk mendapatkan tekstur yang mengembang sempurna.Ikuti resepnya dari buku "Aneka Resep Kue dan Roti" (2013) oleh Aryuni Dianning Wati terbitan MediaPressindo, bikin untuk camilan sore hari. Baca juga: BahanSebuah kiriman dibagikan oleh Foodplace (@my.foodplace)Copyright 2008 - 2024 PT. Kompas Cyber Media (Kompas Gramedia Digital Group). All Rights Reserved.
ABC Luncurkan Kampanye Ahlinya Buat Citarasa dan Platform KhususABC Luncurkan Kampanye Ahlinya Buat Citarasa dan Platform KhususPenulisKOMPAS.com - ABC memperkenalkan kampanye terbarunya "ABC-Ahlinya Buat Citarasa", yang mengangkat dedikasi dan rahasia di balik setiap citarasa dari produk ABC pada Senin (10/6/2-2024).ABC turut meluncurkan sebuah platform kreativitas citarasa yang dinamai Akademi ABC, sebagai wadah belajar yang akan memberikan berbagai informasi, keterampilan, serta inspirasi kreasi citarasa untuk jadi ahlinya masak di rumah. “Sebagai perusahaan makanan yang telah hadir di Indonesia selama hampir lima dekade, kami tidak hanya terus berinovasi, namun juga hadir dengan langkah nyata untuk memberikan dampak positif bagi masyarakat, termasuk bagi para pencinta citarasa di tanah air," kata General Counsel, Head of Corporate & Regulatory Affairs, ABC Indonesia, Mira Buanawati. Ia mengatakan, kampanye Ahlinya Buat Citarasa beserta rangkaian kegiatan dari AKADEMI ABC menjadi salah satu bukti komitmen kami untuk menempatkan konsumen sebagai yang terdepan dan untuk terus berkembang bersama. Baca juga: “Inilah yang menjadi warisan ABC selama puluhan tahun, dimana tiap tetes kecap manis ABC ditangani oleh para soy master melalui rangkaian proses yang ketat," kata Marketing, R&D Director ABC Indonesia, Felicia Julian.Rangkaian proses kecap manis ABC mulai dari menjaga standar kualitas dan keamanan produk, memastikan tahapan dua kali fermentasi, serta tetap mempertahankan metode penyaringan menggunakan kain yang otentik. "Lewat kampanye ini, kami ingin merayakan dedikasi untuk citarasa dan meneruskan warisan ini dalam menemani masyarakat untuk semakin jadi ahlinya buat citarasa bersama ABC, di mana saja dan kapan saja,” pungkas Felicia.AKADEMI ABC akan menjadi sebuah wadah belajar yang terbuka bagi siapapun, yang dipenuhi beragam kegiatan pembelajaran di seputar dunia masak-memasak. Implementasi AKADEMI ABC akan dikemas dalam berbagai bentuk, mulai dari pelatihan skill memasak, tips, demo dan kompetisi memasak, edukasi gizi, hingga peluncuran puluhan kreasi menu yang bisa diakses secara digital sebagai inspirasi sajian masakan di rumah. Rangkaian kegiatan  juga  akan didukung oleh para ahli, penggiat kuliner, dan koki yang berpengalaman. Baca juga: “Kami ingin setiap orang dapat menikmati kekayaan citarasa bersama dengan produk terbaik. Sebagai awal, AKADEMI ABC akan hadir di Pekan Raya Jakarta 2024 dengan beberapa kurikulum pembelajaran," jelas Felicia.Kurikulum Kecap ABC akan mengangkat citarasa kaya rasa dari kecap dan sambal untuk mengeksplorasi berbagai jenis masakan, serta Kurikulum Lintas Citarasa, sebagai wadah kreasi citarasa yang lebih luas untuk seluruh anggota keluarga.Pelaksanaan AKADEMI ABC akan dilakukan melalui berbagai media digital maupun secara langsung di lapangan dengan melibatkan berbagai mitra organisasi dan komunitas penggiat kuliner di lebih dari 25 kota yang tersebar di Jabodetabek, Sumatera, Jawa, Sulawesi, hingga Kalimantan. Kepala Pusat Pelatihan, Kerja sama Internasional BKKBN, Ukik Kusuma Kurniawan, menambahkan pentingnya membuat kegiatan masak di rumah bersama keluarga, mirip dengan kampanye Ahlinya Buat Citarasa. Pada peringatan Hari Keluarga Nasional tahun ini yang jatuh pada 29 Juni 2024, BKKBN juga mengangkat tema "Gerakan Kembali Ke Meja Makan". "Kami percaya, keluarga berperan penting untuk membangun kualitas masyarakat dan salah satunya dapat dimulai dengan menghidupkan kembali berbagai nilai baik dari kegiatan memasak dan makan bersama di rumah," kata Ukki.  Ia mengatakan memasak dapat membangun relasi keluarga yang lebih kuat dan gizi keluarga yang terpenuhi. "Kami menyambut baik inisiatif AKADEMI ABC ini dan berharap dengan mengusung misi yang sama, ABC bersama pemerintah bisa terus bersinergi menciptakan keluarga Indonesia yang berkualitas,” jelasnya.  Baca juga: Copyright 2008 - 2024 PT. Kompas Cyber Media (Kompas Gramedia Digital Group). All Rights Reserved.
5 Masakan Daging Sapi dan Kambing Saat Idul Adha5 Masakan Daging Sapi dan Kambing Saat Idul AdhaTim RedaksiKOMPAS.com – Merayakan hari raya Idul Adha tidak lengkap jika tidak menyantap aneka hidangan berbahan dasar daging sapi dan daging kambing.Biasanya setelah merayakan ibadah kurban, orang-orang akan mengolah daging yang didapatkan menjadi beberapa masakan.Berikut lima masakan daging sapi dan kambing saat Idul Adha. Beberapa di antaranya jadi hidangan wajib, sehingga jika tidak ada hidangan tersebut rasanya kurang afdal.Baca juga: Jelang Idul Adha, Stok Elpiji di Lampung Ditambah 2 Kali LipatSalah satu masakan yang akrab saat Idul Adha adalah sate kambing. Sate kambing memiliki banyak varian dan dapat diolah menjadi hidangan yang berbeda-beda.Seperti sate kambing bumbu kecap, sate kambing Madura bumbu kacang, sate klatak dan masih banyak lagi.Baca juga: Resep Sate Kambing Bumbu Kecap, Olahan Daging Kurban MudahBiasanya saat Idul Adha, sate kambing yang dibuat paling umum adalah sate kambing bumbu kecap yang terbuat dari daging kambing, kecap manis, air asam jawa, bawang putih bubuk, minyak goreng, garam, kaldu jamur, merica bubuk.Selain sate kambing bumbu kecap, sate buntel juga jadi salah satu masakan yang bisa dibuat saat Idul Adha.Sate Buntel adalah makanan khas Solo yang terbuat dari daging kambing cincang yang dibungkus lemak dan dibakar.Hidangan ini awalnya merupakan inovasi sederhana. Namun saat ini menjadi favorit banyak orang.Proses pembuatannya melibatkan mencincang daging kambing dan mencampurkannya dengan bumbu khusus, lalu mencetaknya pada tusuk sate besar, membungkusnya dengan lemak kambing, dan membakarnya hingga matang.Baca juga: Sate Buntel, Kuliner Khas Solo Yang Ada Sejak 1948Hasil akhirnya adalah sate lembut dengan aroma rempah khas yang disajikan dengan saus kecap, irisan tomat, cabai, bawang merah, dan kol.Gulai kambing menjadi salah satu masakan andalan saat Idul Adha. Gulai adalah masakan  Sumatra yang menggunakan daging ayam, ikan, kambing, sapi, jeroan, atau sayuran seperti nangka muda dan daun singkong, dimasak dalam kuah bumbu rempah gurih.Ciri khasnya adalah bumbu kaya rempah seperti kunyit, ketumbar, lada, lengkuas, jahe, cabai merah, bawang, adas, pala, serai, kayu manis, dan jintan, dimasak dalam santan, memberikan warna kuning dari kunyit.Salah satu masakan olahan daging sapi yang bisa dibuat saat Idul Adha adalah rawon khas Jawa Timur.Dilansir dari laman kemenparekraf, Rawon adalah hidangan khas Jawa Timur yang konon sudah ada sejak zaman Kerajaan Majapahit, seperti disebutkan dalam Prasasti Taji (901 M).Copyright 2008 - 2024 PT. Kompas Cyber Media (Kompas Gramedia Digital Group). All Rights Reserved.
Bahaya Makan Jeroan Kebanyakan, Waspada Saat Idul AdhaBahaya Makan Jeroan Kebanyakan, Waspada Saat Idul AdhaTim RedaksiKOMPAS.com – Saat Idul Adha biasanya saat melaksanakan ibadah kurban kamu akan diberikan daging atau organ dalam hewan kurban tersebut.Bagi kamu yang berniat untuk membuat suatu hidangan dengan jeroan atau organ dalam sebaiknya perlu memperhatikan efek samping dari mengonsumsinya,Meskipun lezat, jeroan sebaiknya tidak dikonsumsi terlalu sering atau dalam jumlah banyak karena dapat berdampak buruk pada kesehatan.Baca juga: Efek Negatif Mengonsumsi Jeroan terhadap Asam UratJeroan merupakan organ dalam hewan yang diolah menjadi berbagai masakan, seperti lidah, babat, usus, hati, paru, jantung, limpa, dan otak.Meskipun jeroan kaya akan gizi, konsumsi berlebihan dapat membahayakan kesehatan karena kandungan kolesterol, lemak, purin, dan zat berbahaya lainnya yang tinggi.Sebuah kiriman dibagikan oleh Foodplace (@my.foodplace)Dilansir dari laman Kementerian Kesehatan (Kemenkes), simak 10 efek samping mengonsumsi jeroan terhadap kesehatan berikut ini.Banyak ahli menyatakan bahwa jeroan mengandung berbagai racun karena hati dan ginjal hewan menyaring racun dari darah.Baca juga: Resep Garang Asem Ayam Khas Solo, Bisa Pakai JeroanBeberapa racun yang ditemukan dalam jeroan termasuk merkuri, timah, arsenik, kromium, kadmium dan selenium.Karena fungsi liver pada hewan mirip dengan manusia, racun-racun tersebut akan mengendap di liver. Oleh karena itu, mengonsumsi hati sama dengan mengonsumsi racun.Copyright 2008 - 2024 PT. Kompas Cyber Media (Kompas Gramedia Digital Group). All Rights Reserved.
