Festival Kuliner Semarang, Lezatnya Cita Rasa NusantaraFestival Kuliner Semarang, Lezatnya Cita Rasa NusantaraTim RedaksiKOMPAS.com - Lebih dari 100 tenant kuliner dan UMKM lokal memeriahkan Cleo Festival Kuliner Semarang, Jawa Tengah, Sabtu-Minggu, 25-26 Mei 2024. Beragam kuliner bercita rasa legendaris nusantara hadir.Seperti Soto Kudus Mbak Lin, Es Puter Cong Lik, Sate, Siomay, dan lainnya. Kuliner yang tentunya sudah tidak asing bagi warga Semarang dan sekitarnya, karena cita rasa yang enak dan legendaris.Uniknya, Festival Kuliner ini digelar di tempat bersejarah Kelenteng Sam Poo Kong Semarang. Lokasi ini dipilih sebagai venue karena nilai historisnya yang menjadi titik awal terciptanya akulturasi kebudayaan Tionghoa dan Jawa.Baca juga: 5 Tempat Makan Soto Daging di Semarang, Mulai Rp 6.000Dalam sejarahnya, Kelenteng Sam Poo Kong awalnya merupakan salah satu lokasi peristirahatan rombongan Laksamana Cheng Ho, seorang pengembara Muslim dari China yang sedang melintasi wilayah Jawa Tengah.Hingga sekarang, Kelenteng Sam Poo Kong menjadi destinasi wisata utama masyarakat Indonesia dari berbagai suku dan agama di daerah Kota Semarang, Jawa Tengah.Sebuah kiriman dibagikan oleh Kompas Travel (@kompas.travel)“Kami senang sekali bisa membawa Cleo Festival Kuliner ke Jawa Tengah. Murni Rasa Nusantara yang menjadi tema acara di setiap tahunnya ini, menginspirasi kami untuk terus mendukung perkembangan bisnis UMKM, khususnya di bidang kuliner,” kata Direktur Utama PT Sariguna Primatirta Tbk, Melisa Tanoko, Minggu (26/5/2024).Selain kuliner nusantara, festival ini dimeriahkan Fun Walk dengan beragam door prize menarik seperti sepeda gunung, mesin cuci, sepeda motor, hingga 1 unit mobil dengan total hadiah ratusan juta rupiah.Tak hanya itu, para pengunjung juga bisa mengikuti Kompetisi Bola Basket 3-on-3, Kompetisi Band dengan talenta lokal berbakat, online video competition, dance competition, lomba mewarnai untuk anak-anak, dan zumba.Pada puncak acara dimeriahkan penampilan spesial dari headliner Shaggydog dan For Revenge.Direktur Penjualan Distribusi Toto Sucartono menambahkan, festival ini ingin memperkenalkan nilai-nilai budaya Indonesia seperti makanan, pariwisata, dengan mengadakan event di tempat tempat bersejarah.Baca juga: Jalur Pantura Semarang-Demak Macet Parah, Apa Penyebabnya?“Karena tempat bersejarah adalah aset yang kadang kita lupa. Maka kita berpartisipasi ini kita ikut menggelorakan ke seluruh Indonesia,” pungkasnya. Copyright 2008 - 2024 PT. Kompas Cyber Media (Kompas Gramedia Digital Group). All Rights Reserved.
Festival Kuliner Semarang, Lezatnya Cita Rasa NusantaraFestival Kuliner Semarang, Lezatnya Cita Rasa NusantaraTim RedaksiKOMPAS.com - Lebih dari 100 tenant kuliner dan UMKM lokal memeriahkan Cleo Festival Kuliner Semarang, Jawa Tengah, Sabtu-Minggu, 25-26 Mei 2024. Beragam kuliner bercita rasa legendaris nusantara hadir.Seperti Soto Kudus Mbak Lin, Es Puter Cong Lik, Sate, Siomay, dan lainnya. Kuliner yang tentunya sudah tidak asing bagi warga Semarang dan sekitarnya, karena cita rasa yang enak dan legendaris.Uniknya, Festival Kuliner ini digelar di tempat bersejarah Kelenteng Sam Poo Kong Semarang. Lokasi ini dipilih sebagai venue karena nilai historisnya yang menjadi titik awal terciptanya akulturasi kebudayaan Tionghoa dan Jawa.Baca juga: 5 Tempat Makan Soto Daging di Semarang, Mulai Rp 6.000Dalam sejarahnya, Kelenteng Sam Poo Kong awalnya merupakan salah satu lokasi peristirahatan rombongan Laksamana Cheng Ho, seorang pengembara Muslim dari China yang sedang melintasi wilayah Jawa Tengah.Hingga sekarang, Kelenteng Sam Poo Kong menjadi destinasi wisata utama masyarakat Indonesia dari berbagai suku dan agama di daerah Kota Semarang, Jawa Tengah.Sebuah kiriman dibagikan oleh Kompas Travel (@kompas.travel)“Kami senang sekali bisa membawa Cleo Festival Kuliner ke Jawa Tengah. Murni Rasa Nusantara yang menjadi tema acara di setiap tahunnya ini, menginspirasi kami untuk terus mendukung perkembangan bisnis UMKM, khususnya di bidang kuliner,” kata Direktur Utama PT Sariguna Primatirta Tbk, Melisa Tanoko, Minggu (26/5/2024).Selain kuliner nusantara, festival ini dimeriahkan Fun Walk dengan beragam door prize menarik seperti sepeda gunung, mesin cuci, sepeda motor, hingga 1 unit mobil dengan total hadiah ratusan juta rupiah.Tak hanya itu, para pengunjung juga bisa mengikuti Kompetisi Bola Basket 3-on-3, Kompetisi Band dengan talenta lokal berbakat, online video competition, dance competition, lomba mewarnai untuk anak-anak, dan zumba.Pada puncak acara dimeriahkan penampilan spesial dari headliner Shaggydog dan For Revenge.Direktur Penjualan Distribusi Toto Sucartono menambahkan, festival ini ingin memperkenalkan nilai-nilai budaya Indonesia seperti makanan, pariwisata, dengan mengadakan event di tempat tempat bersejarah.Baca juga: Jalur Pantura Semarang-Demak Macet Parah, Apa Penyebabnya?“Karena tempat bersejarah adalah aset yang kadang kita lupa. Maka kita berpartisipasi ini kita ikut menggelorakan ke seluruh Indonesia,” pungkasnya. Copyright 2008 - 2024 PT. Kompas Cyber Media (Kompas Gramedia Digital Group). All Rights Reserved.
Inovasi Unik Sendok Elektrik Jepang yang Dapat Tingkatkan Rasa AsinInovasi Unik Sendok Elektrik Jepang yang Dapat Tingkatkan Rasa AsinTim RedaksiKOMPAS.com – Pada tahun 2024, Jepang menghadirkan inovasi unik dengan sendok berteknologi tinggi yang menciptakan medan listrik di dalam mulut untuk mengelabuhi otak agar makanan terasa lebih asin dari yang sebenarnya.Kirin Holdings, setelah janjinya pada tahun 2022, kini sendok garam elektrik Elecisalt telah hadir dan sudah mulai dijual.Melansir dari laman Sora News 24, sendok ini bekerja dengan mengirimkan muatan listrik ke makanan dan menciptakan medan listrik di sekitar lidah yang membuat ion natrium berkumpul dan menciptakan persepsi rasa yang lebih kuat.Baca juga: Jepang Sengaja Tutupi Pemandangan Gunung Fuji dengan Kain, Apa Alasannya?Meskipun butuh waktu lebih lama dari yang diharapkan, produk ini akhirnya tersedia untuk dijual ke masyarakat.Kirin Holdings telah mengembangkan sumpit dan mangkuk penambah rasa asin elektrik, tetapi fokusnya adalah pada sendok garam elektrik karena penelitiannya menunjukkan bahwa kaldu ramen dan sup adalah godaan umum bagi mereka yang ingin mengurangi natrium.Sendok garam elektrik juga direkomendasikan untuk nasi kari dan nasi goreng karena muatan listriknya dapat meningkatkan rasa umami.Namun, ada sejumlah orang yang tidak disarankan menggunakan produk ini, terutama mereka yang memiliki kondisi medis tertentu.Beberapa di antaranya, orang dengan gangguan saraf wajah, alergi logam, atau implan medis bertenaga listrik, serta mereka yang tidak bisa merasakan rasa sakit atau suhu.Baca juga: Resep Sambal Bawang Teri Asin, Lauk Praktis untuk Sahur di RumahOrang yang sedang dalam perawatan gigi, wanita hamil, dan anak-anak juga disarankan untuk menggunakan sendok konvensional.Sendok garam elektrik saat ini ditawarkan secara online langsung dari Kirin di sini, dengan harga 19.800 yen atau sekitar Rp 2.029.072.Namun, karena jumlah awalnya terbatas hingga 200 unit, pembeli sendok garam elektrik ini akan dipilih melalui undian di antara mereka yang melakukan pemesanan mulai dari 20 Mei 2024 sampai 2 Juni 2024.Pengiriman dijadwalkan dilakukan pada pertengahan Juni dan stok ulang dijadwalkan pada tanggal berikutnya.Baca juga: 7 Manfaat Konsumsi Satu Sendok Madu Setiap Hari, Cegah Kanker dan PenuaanSendok garam elektik ini juga akan tersedia di beberapa cabang toko peralatan rumah tangga Jepang, Hands, pada bulan Juni.Copyright 2008 - 2024 PT. Kompas Cyber Media (Kompas Gramedia Digital Group). All Rights Reserved.
Inovasi Unik Sendok Elektrik Jepang yang Dapat Tingkatkan Rasa AsinInovasi Unik Sendok Elektrik Jepang yang Dapat Tingkatkan Rasa AsinTim RedaksiKOMPAS.com – Pada tahun 2024, Jepang menghadirkan inovasi unik dengan sendok berteknologi tinggi yang menciptakan medan listrik di dalam mulut untuk mengelabuhi otak agar makanan terasa lebih asin dari yang sebenarnya.Kirin Holdings, setelah janjinya pada tahun 2022, kini sendok garam elektrik Elecisalt telah hadir dan sudah mulai dijual.Melansir dari laman Sora News 24, sendok ini bekerja dengan mengirimkan muatan listrik ke makanan dan menciptakan medan listrik di sekitar lidah yang membuat ion natrium berkumpul dan menciptakan persepsi rasa yang lebih kuat.Baca juga: Jepang Sengaja Tutupi Pemandangan Gunung Fuji dengan Kain, Apa Alasannya?Meskipun butuh waktu lebih lama dari yang diharapkan, produk ini akhirnya tersedia untuk dijual ke masyarakat.Kirin Holdings telah mengembangkan sumpit dan mangkuk penambah rasa asin elektrik, tetapi fokusnya adalah pada sendok garam elektrik karena penelitiannya menunjukkan bahwa kaldu ramen dan sup adalah godaan umum bagi mereka yang ingin mengurangi natrium.Sendok garam elektrik juga direkomendasikan untuk nasi kari dan nasi goreng karena muatan listriknya dapat meningkatkan rasa umami.Namun, ada sejumlah orang yang tidak disarankan menggunakan produk ini, terutama mereka yang memiliki kondisi medis tertentu.Beberapa di antaranya, orang dengan gangguan saraf wajah, alergi logam, atau implan medis bertenaga listrik, serta mereka yang tidak bisa merasakan rasa sakit atau suhu.Baca juga: Resep Sambal Bawang Teri Asin, Lauk Praktis untuk Sahur di RumahOrang yang sedang dalam perawatan gigi, wanita hamil, dan anak-anak juga disarankan untuk menggunakan sendok konvensional.Sendok garam elektrik saat ini ditawarkan secara online langsung dari Kirin di sini, dengan harga 19.800 yen atau sekitar Rp 2.029.072.Namun, karena jumlah awalnya terbatas hingga 200 unit, pembeli sendok garam elektrik ini akan dipilih melalui undian di antara mereka yang melakukan pemesanan mulai dari 20 Mei 2024 sampai 2 Juni 2024.Pengiriman dijadwalkan dilakukan pada pertengahan Juni dan stok ulang dijadwalkan pada tanggal berikutnya.Baca juga: 7 Manfaat Konsumsi Satu Sendok Madu Setiap Hari, Cegah Kanker dan PenuaanSendok garam elektik ini juga akan tersedia di beberapa cabang toko peralatan rumah tangga Jepang, Hands, pada bulan Juni.Copyright 2008 - 2024 PT. Kompas Cyber Media (Kompas Gramedia Digital Group). All Rights Reserved.
Fore Coffee Luncurkan 3 Minuman Baru, Ada Kopi dan Non-KopiFore Coffee Luncurkan 3 Minuman Baru, Ada Kopi dan Non-KopiTim RedaksiJAKARTA, KOMPAS.com – Fore Coffee meluncurkan tiga varian minuman terbaru bertema The New Coffee Culture di Jakarta Selatan, Rabu (22/5/2024). Terdapat dua minuman kopi dan satu non-kopi yaitu Cappucino Caramelo, Vanilla Oat Latte, dan Matcha Strawberry Cream.Baca juga:Minuman ini disebut hadir untuk merayakan revolusi yang sedang terjadi dalam dunia kopi, tidak hanya sebatas membuat dan menikmati kopi, tapi juga menghargai segelas kopi melalui inovasi rasa dan cara menikmatinya."Kami selalu berupaya untuk membawa inovasi yang dapat dinikmati oleh semua kalangan, dari pecinta kopi hingga mereka yang baru mengenal kopi," kata Co-Founder dan CEO Fore Coffee, Vico Lomar saat peluncuran di Jakarta Selatan, Rabu (22/5/2024).Melalui kampanye #FOREVOLUTION dan peluncuran menu Taste of the New Culture, pihaknya ingin mengajak orang-orang untuk merayakan budaya kopi yang baru (new coffee culture), sekaligus menciptakan pengalaman menikmati kopi yang belum pernah ada sebelumnya.Baca juga: KOMPAS.com/Aska Bagus Aldika Cappucino Caramelo, salah satu minuman baru dari Fore Coffee. Foto diambil pada Kamis (23/5/2024). Pada Rabu (22/5/2024), Foree Coffee meluncurkan tiga minuman baru yaitu Cappucino Caramelo, Vanilla Oat Latte, dan Matcha Strawberry Cream. Kompas.com pun berkesempatan menyicipi varian terbaru dari Fore Coffee ini. Cappucino Caramelo, misalnya, memiliki aroma kopi yang cukup kuat, tapi tetap creamy dan tidak terlalu manis.Sementara itu, varian non-kopi Matcha Strawberry Cream punya rasa yang unik karena ada perpaduan rasa pahit khas matcha, serta asam dan manis dari stroberi. Ketiga minuman baru ini tersedia di seluruh gerai Fore Coffee mulai Rabu (22/5/2024).Baca juga: A post shared by Foodplace (@my.foodplace)Copyright 2008 - 2024 PT. Kompas Cyber Media (Kompas Gramedia Digital Group). All Rights Reserved.
Fore Coffee Luncurkan 3 Minuman Baru, Ada Kopi dan Non-KopiFore Coffee Luncurkan 3 Minuman Baru, Ada Kopi dan Non-KopiTim RedaksiJAKARTA, KOMPAS.com – Fore Coffee meluncurkan tiga varian minuman terbaru bertema The New Coffee Culture di Jakarta Selatan, Rabu (22/5/2024). Terdapat dua minuman kopi dan satu non-kopi yaitu Cappucino Caramelo, Vanilla Oat Latte, dan Matcha Strawberry Cream.Baca juga:Minuman ini disebut hadir untuk merayakan revolusi yang sedang terjadi dalam dunia kopi, tidak hanya sebatas membuat dan menikmati kopi, tapi juga menghargai segelas kopi melalui inovasi rasa dan cara menikmatinya."Kami selalu berupaya untuk membawa inovasi yang dapat dinikmati oleh semua kalangan, dari pecinta kopi hingga mereka yang baru mengenal kopi," kata Co-Founder dan CEO Fore Coffee, Vico Lomar saat peluncuran di Jakarta Selatan, Rabu (22/5/2024).Melalui kampanye #FOREVOLUTION dan peluncuran menu Taste of the New Culture, pihaknya ingin mengajak orang-orang untuk merayakan budaya kopi yang baru (new coffee culture), sekaligus menciptakan pengalaman menikmati kopi yang belum pernah ada sebelumnya.Baca juga: KOMPAS.com/Aska Bagus Aldika Cappucino Caramelo, salah satu minuman baru dari Fore Coffee. Foto diambil pada Kamis (23/5/2024). Pada Rabu (22/5/2024), Foree Coffee meluncurkan tiga minuman baru yaitu Cappucino Caramelo, Vanilla Oat Latte, dan Matcha Strawberry Cream. Kompas.com pun berkesempatan menyicipi varian terbaru dari Fore Coffee ini. Cappucino Caramelo, misalnya, memiliki aroma kopi yang cukup kuat, tapi tetap creamy dan tidak terlalu manis.Sementara itu, varian non-kopi Matcha Strawberry Cream punya rasa yang unik karena ada perpaduan rasa pahit khas matcha, serta asam dan manis dari stroberi. Ketiga minuman baru ini tersedia di seluruh gerai Fore Coffee mulai Rabu (22/5/2024).Baca juga: A post shared by Foodplace (@my.foodplace)Copyright 2008 - 2024 PT. Kompas Cyber Media (Kompas Gramedia Digital Group). All Rights Reserved.
Pusat Pendidikan Kuliner Baru di Jakarta Dibuka, Ada Kelas OnlinePusat Pendidikan Kuliner Baru di Jakarta Dibuka, Ada Kelas OnlineTim RedaksiJAKARTA, KOMPAS.com - Kumala Academy resmi dibuka sebagai institusi pendidikan kuliner yang berfokus pada pengembangan keterampilan dalam dunia makanan dan minuman.Lembaga pendidikan berbasis di Jakarta ini menyasar para pekerja kuliner, calon pekerja kuliner, dan semua orang yang berminat belajar lebih jauh mengenai kuliner.Baca juga: Mengenal Le Cordon Bleu, Sekolah Kuliner Berusia Lebih Dari 1 Abad"Kami ingin menjadi pusat pendidikan terdepan yang berfokus pada pengembangan industri hospitality serta makanan dan minuman, menyediakan pelatihan yang sesuai dengan standar industri dan mengikuti tren terbaru," kata Co-founder Kumala Academy, Yenny Kusuma saat bergabung via daring dalam peresmian Kumala Academy di Kumala Garage Store, Jakarta Barat, Selasa (21/5/2024).Program belajar Kumala Academy akan mencakup berbagai aspek penting dalam dunia kuliner yakni:Baca juga: 7 Prediksi Tren Kuliner Dunia pada 2024, Cromboloni Masih Berlanjut?Adapun Kumala Academy bertempat di Kumala Home & Kitchen, Jalan Dr. Susilo IV Nomor 11A, Grogol, Kecamatan Grogol Petamburan, Jakarta Barat.Bangunan yang terdiri dari tiga lantai ini disiapkan menjadi tempat belajar teori dan praktik kuliner para murid. Meski demikian, Kumala Academy juga menyiapkan kelas online (daring) untuk pendaftar dari luar Jakarta."Kami juga menyasar (murid) dari luar Jakarta yang memang kebutuhan di kota-kota besar juga banyak. Bakal ada banyak kelas online," ucap Co-Founder Kumala Academy sekaligus penulis dan praktisi kuliner Indonesia, Kevindra Soemantri.Kumala Academy mengadakan kelas perdananya untuk dasar baking bertajuk "Sourdough Secrets: Mastering the Art of Fermented Bread" pada Rabu (22/5/2024) oleh dr. Debryna Dewi, Sourdough Doctor.Baca juga: Cara Jadi Koki Profesional, Cukup Lulus SMK Boga atau Harus Kuliah?A post shared by Foodplace (@my.foodplace)Copyright 2008 - 2024 PT. Kompas Cyber Media (Kompas Gramedia Digital Group). All Rights Reserved.
Resep Pizza Teflon Antigagal, Rasa Bintang LimaResep Pizza Teflon Antigagal, Rasa Bintang LimaPenulisDelishPemulaKOMPAS.com - Pizza teflon adalah solusi praktis untuk menikmati pizza lezat ala restoran tanpa oven.Dengan bahan-bahan yang sederhana dan metode yang mudah, resep pizza teflon ini cocok untuk pemula sekalipun.Hasilnya, pizza dengan tekstur empuk dan lembut yang tak kalah dengan pizza bintang lima. Ingin tahu cara membuat pizza teflon rumahan yang anti gagal?Simak cara bikin pizza teflon berikut ini dan ciptakan pizza ala Pizza Hut di rumah, dilansir dari laman Delish. Baca juga: Untuk Saus TomatSebuah kiriman dibagikan oleh Foodplace (@my.foodplace)Copyright 2008 - 2024 PT. Kompas Cyber Media (Kompas Gramedia Digital Group). All Rights Reserved.
Pusat Pendidikan Kuliner Baru di Jakarta Dibuka, Ada Kelas OnlinePusat Pendidikan Kuliner Baru di Jakarta Dibuka, Ada Kelas OnlineTim RedaksiJAKARTA, KOMPAS.com - Kumala Academy resmi dibuka sebagai institusi pendidikan kuliner yang berfokus pada pengembangan keterampilan dalam dunia makanan dan minuman.Lembaga pendidikan berbasis di Jakarta ini menyasar para pekerja kuliner, calon pekerja kuliner, dan semua orang yang berminat belajar lebih jauh mengenai kuliner.Baca juga: Mengenal Le Cordon Bleu, Sekolah Kuliner Berusia Lebih Dari 1 Abad"Kami ingin menjadi pusat pendidikan terdepan yang berfokus pada pengembangan industri hospitality serta makanan dan minuman, menyediakan pelatihan yang sesuai dengan standar industri dan mengikuti tren terbaru," kata Co-founder Kumala Academy, Yenny Kusuma saat bergabung via daring dalam peresmian Kumala Academy di Kumala Garage Store, Jakarta Barat, Selasa (21/5/2024).Program belajar Kumala Academy akan mencakup berbagai aspek penting dalam dunia kuliner yakni:Baca juga: 7 Prediksi Tren Kuliner Dunia pada 2024, Cromboloni Masih Berlanjut?Adapun Kumala Academy bertempat di Kumala Home & Kitchen, Jalan Dr. Susilo IV Nomor 11A, Grogol, Kecamatan Grogol Petamburan, Jakarta Barat.Bangunan yang terdiri dari tiga lantai ini disiapkan menjadi tempat belajar teori dan praktik kuliner para murid. Meski demikian, Kumala Academy juga menyiapkan kelas online (daring) untuk pendaftar dari luar Jakarta."Kami juga menyasar (murid) dari luar Jakarta yang memang kebutuhan di kota-kota besar juga banyak. Bakal ada banyak kelas online," ucap Co-Founder Kumala Academy sekaligus penulis dan praktisi kuliner Indonesia, Kevindra Soemantri.Kumala Academy mengadakan kelas perdananya untuk dasar baking bertajuk "Sourdough Secrets: Mastering the Art of Fermented Bread" pada Rabu (22/5/2024) oleh dr. Debryna Dewi, Sourdough Doctor.Baca juga: Cara Jadi Koki Profesional, Cukup Lulus SMK Boga atau Harus Kuliah?A post shared by Foodplace (@my.foodplace)Copyright 2008 - 2024 PT. Kompas Cyber Media (Kompas Gramedia Digital Group). All Rights Reserved.
